id,Year,Page,COR,LOE,Recommendation,SourceFile
id_02197,2020,105,Class 1,C-LD,"In patients with symptoms of angina, objective evidence of ischemia, decreased LV systolic function, history of CAD, or coronary risk factors (including men >40 years of age and postmenopausal women), invasive coronary angiography is indicated before valve intervention.1–8",otto-et-al-2020-acc-aha-guideline-for-the-management-of-patients-with-valvular-heart-disease-a-report-of-the-american.pdf
id_02198,2020,105,Class 1,C-LD,"In patients with chronic severe secondary MR, invasive coronary angiography should be performed as part of the evaluation.9–11",otto-et-al-2020-acc-aha-guideline-for-the-management-of-patients-with-valvular-heart-disease-a-report-of-the-american.pdf
id_02199,2020,105,2A,B-NR,"In selected patients with a low to intermediate pretest probability of CAD, contrast-enhanced coronary CT angiography is reasonable to exclude the presence of significant obstructive CAD.12–18",otto-et-al-2020-acc-aha-guideline-for-the-management-of-patients-with-valvular-heart-disease-a-report-of-the-american.pdf
id_02200,2020,105,2A,C-LD,"In patients undergoing valve repair or replacement with significant proximal CAD (≥70% reduction in luminal diameter in major coronary arteries or ≥50% reduction in luminal diameter in the left main coronary artery and/or physiologically significance), CABG is reasonable for selective patients.19,20",otto-et-al-2020-acc-aha-guideline-for-the-management-of-patients-with-valvular-heart-disease-a-report-of-the-american.pdf
id_02201,2020,106,Class 1,C-LD,"In patients with VHD and AF for whom surgical intervention is planned, the potential symptomatic benefits and additional procedural risks of adjunctive arrhythmia surgery at the time of cardiac valvular surgery should be discussed with the patient.1–11",otto-et-al-2020-acc-aha-guideline-for-the-management-of-patients-with-valvular-heart-disease-a-report-of-the-american.pdf
id_02202,2020,106,2A,B-R,"For symptomatic patients with paroxysmal or persistent AF who are undergoing valvular surgery, surgical pulmonary vein isolation or a maze procedure can be beneficial to reduce symptoms and prevent recurrent arrhythmias.1,2,12–15",otto-et-al-2020-acc-aha-guideline-for-the-management-of-patients-with-valvular-heart-disease-a-report-of-the-american.pdf
id_02203,2020,106,2A,B-NR,"For patients with AF or atrial flutter who are undergoing valve surgery, LA appendage ligation/excision is reasonable to reduce the risk of thromboembolic events.16–19",otto-et-al-2020-acc-aha-guideline-for-the-management-of-patients-with-valvular-heart-disease-a-report-of-the-american.pdf
id_02204,2020,106,2A,B-NR,"In patients undergoing LA surgical ablation of atrial arrhythmias and/or LA appendage ligation/excision, anticoagulation therapy is reasonable for at least 3 months after the procedure.20–22",otto-et-al-2020-acc-aha-guideline-for-the-management-of-patients-with-valvular-heart-disease-a-report-of-the-american.pdf
id_02205,2020,106,Class 3: Harm,B-NR,"For patients without atrial arrhythmias who are undergoing valvular surgery, LA appendage occlusion/exclusion/amputation is potentially harmful.23",otto-et-al-2020-acc-aha-guideline-for-the-management-of-patients-with-valvular-heart-disease-a-report-of-the-american.pdf
id_02206,2020,107,Class 1,C-EO,"In patients with clinically suspected moderate or greater degrees of valvular stenosis or regurgitation who are undergoing noncardiac surgery, preoperative echocardiography is recommended.",otto-et-al-2020-acc-aha-guideline-for-the-management-of-patients-with-valvular-heart-disease-a-report-of-the-american.pdf
id_02207,2020,108,Class 1,C-EO,"In patients who meet standard indications for intervention for VHD (replacement and repair) on the basis of symptoms and disease severity, intervention should be performed before elective noncardiac surgery to reduce perioperative risk if possible, depending on the urgency and risk of the noncardiac procedure.1",otto-et-al-2020-acc-aha-guideline-for-the-management-of-patients-with-valvular-heart-disease-a-report-of-the-american.pdf
id_02208,2020,109,2A,B-R,"In asymptomatic patients with moderate or greater degrees of AS and normal LV systolic function, it is reasonable to perform elective noncardiac surgery.1–3",otto-et-al-2020-acc-aha-guideline-for-the-management-of-patients-with-valvular-heart-disease-a-report-of-the-american.pdf
id_02209,2020,109,2A,C-EO,"In asymptomatic patients with moderate or greater degrees of rheumatic MS with less than severe pulmonary hypertension (pulmonary artery systolic pressure <50 mm Hg), it is reasonable to perform elective noncardiac surgery.",otto-et-al-2020-acc-aha-guideline-for-the-management-of-patients-with-valvular-heart-disease-a-report-of-the-american.pdf
id_02210,2020,109,2A,C-LD,"In asymptomatic patients with moderate or greater degrees of MR and normal LV systolic function with less than severe pulmonary hypertension (pulmonary artery systolic pressure <50 mm Hg), it is reasonable to perform elective noncardiac surgery.4–7",otto-et-al-2020-acc-aha-guideline-for-the-management-of-patients-with-valvular-heart-disease-a-report-of-the-american.pdf
id_02211,2020,109,2A,C-LD,"In asymptomatic patients with moderate or greater degrees of AR and normal LV systolic function, it is reasonable to perform elective noncardiac surgery.8",otto-et-al-2020-acc-aha-guideline-for-the-management-of-patients-with-valvular-heart-disease-a-report-of-the-american.pdf
id_02212,2022,16,Class 1,B-NR,"In patients with known or suspected aortic disease, aortic diameters should be mea- sured at reproducible anatomic landmarks perpendicular to axis of blood flow, and these measurement methods should be reported in a clear and consistent manner. In cases of asymmetric or oval contour, the longest diam- eter and its perpendicular diameter should be reported.3,4",isselbacher-et-al-2022-acc-aha-guideline-for-the-diagnosis-and-management-of-aortic-disease-a-report-of-the-american.pdf
id_02213,2022,17,Class 1,C-LD,"In patients with known or suspected aortic disease, episodic and cumulative ionizing radi- ation doses should be kept as low as feasible while maintaining diagnostic image quality.5-7",isselbacher-et-al-2022-acc-aha-guideline-for-the-diagnosis-and-management-of-aortic-disease-a-report-of-the-american.pdf
id_02214,2022,17,Class 1,C-EO,"In patients with known or suspected aortic disease, when performing CT or MR imaging, it is recommended that the root and ascending aortic diameters be measured from inner-edge to inner-edge, using an electrocardiographic- synchronized technique. If there are aortic wall abnormalities, such as atherosclerosis or discrete wall thickening (more common in the distal aorta), the outer-edge to outer-edge diameter should be reported (Table 4).",isselbacher-et-al-2022-acc-aha-guideline-for-the-diagnosis-and-management-of-aortic-disease-a-report-of-the-american.pdf
id_02215,2022,17,Class 1,C-EO,"In patients with known or suspected aortic disease, the aortic root diameter should be recorded as maximum sinus to sinus mea- surement. In the setting of known asymmetry, multiple measurements should be reported, and both short- and long-axis images of the root should be obtained to avoid underestima- tion of the diameter.",isselbacher-et-al-2022-acc-aha-guideline-for-the-diagnosis-and-management-of-aortic-disease-a-report-of-the-american.pdf
id_02216,2022,17,2A,C-LD,"In patients with known or suspected aortic disease, it is reasonable that a dilated root or ascending aorta be indexed to patient height or BSA in the report, to aid in clinical risk assessment.8-11",isselbacher-et-al-2022-acc-aha-guideline-for-the-diagnosis-and-management-of-aortic-disease-a-report-of-the-american.pdf
id_02217,2022,17,2A,C-EO,"In patients with known or suspected aortic disease, when performing echocardiography, it is reasonable to measure the aorta from leading-edge to leading-edge, perpendicular to the axis of blood flow.",isselbacher-et-al-2022-acc-aha-guideline-for-the-diagnosis-and-management-of-aortic-disease-a-report-of-the-american.pdf
id_02218,2022,22,Class 1,C-EO,"For patients with acute aortic disease that requires urgent repair, a multidisciplinary team should determine the most suitable interven- tion.",isselbacher-et-al-2022-acc-aha-guideline-for-the-diagnosis-and-management-of-aortic-disease-a-report-of-the-american.pdf
id_02219,2022,22,2A,C-LD,"For patients who are asymptomatic with extensive aortic disease, or who may benefit from complex open and endovascular aortic repairs, or with multiple comorbidities for whom intervention is considered, referral to a high-volume center (performing at least 30-40 aortic procedures annually) with expe- rienced surgeons in a Multidisciplinary Aortic Team is reasonable to optimize treatment outcomes.1-6",isselbacher-et-al-2022-acc-aha-guideline-for-the-diagnosis-and-management-of-aortic-disease-a-report-of-the-american.pdf
id_02220,2022,24,Class 1,C-LD,"In patients with aortic disease, shared deci- sion-making is recommended when determin- ing the appropriate thresholds for intervention, deciding on the type of surgical repair, choos- ing between open surgical versus endovascu- lar approaches; and in medical management and surveillance.1-6",isselbacher-et-al-2022-acc-aha-guideline-for-the-diagnosis-and-management-of-aortic-disease-a-report-of-the-american.pdf
id_02221,2022,24,Class 1,C-EO,"In patients with aortic disease who are contem- plating pregnancy or who are pregnant, shared decision-making is recommended when con- sidering the cardiovascular risks of pregnancy, the diameter thresholds for prophylactic aortic surgery, and the mode of delivery.",isselbacher-et-al-2022-acc-aha-guideline-for-the-diagnosis-and-management-of-aortic-disease-a-report-of-the-american.pdf
id_02222,2022,28,Class 1,B-NR,"In patients with aortic root/ascending aortic aneurysms or aortic dissection, obtaining a multigenerational family history of TAD, unex- plained sudden deaths, and peripheral and intracranial aneurysms is ­recommended.1-3",isselbacher-et-al-2022-acc-aha-guideline-for-the-diagnosis-and-management-of-aortic-disease-a-report-of-the-american.pdf
id_02223,2022,28,Class 1,B-NR,"In patients with aortic root/ascending aortic aneurysms or aortic dissection and risk factors for HTAD (Table 8, Figure 17), genetic testing to identify pathogenic/ likely pathogenic variants (ie, mutations) is ­recommended.4-6",isselbacher-et-al-2022-acc-aha-guideline-for-the-diagnosis-and-management-of-aortic-disease-a-report-of-the-american.pdf
id_02224,2022,28,Class 1,B-NR,"In patients with an established pathogenic or likely pathogenic variant in a gene predispos- ing to HTAD, it is recommended that genetic counseling be provided and the patient’s clini- cal management be informed by the specific gene and variant in the gene.7-9",isselbacher-et-al-2022-acc-aha-guideline-for-the-diagnosis-and-management-of-aortic-disease-a-report-of-the-american.pdf
id_02225,2022,28,Class 1,B-NR,"In patients with TAD who have a pathogenic/ likely pathogenic variant, genetic testing of at- risk biological relatives (ie, cascade testing) is recommended.6,10,11 In family members who are found by genetic screening to have inherited the pathogenic/likely pathogenic variant, aortic imaging with TTE (if aortic root and ascending aorta are adequately visualized, otherwise with CT or MRI) is recommended.4,5,12",isselbacher-et-al-2022-acc-aha-guideline-for-the-diagnosis-and-management-of-aortic-disease-a-report-of-the-american.pdf
id_02226,2022,28,Class 1,B-NR,"In a family with aortic root/ascending aor- tic aneurysms or aortic dissection, if the disease-causing variant is not identified with genetic testing, screening aortic imag- ing (as per recommendation 4) of at-risk biological relatives (ie, cascade testing) is ­recommended.13-15",isselbacher-et-al-2022-acc-aha-guideline-for-the-diagnosis-and-management-of-aortic-disease-a-report-of-the-american.pdf
id_02227,2022,28,Class 1,C-LD,"In patients with aortic root/ascending aor- tic aneurysms or aortic dissection, in the absence of either a known family history of TAD or pathogenic/likely pathogenic variant, screening aortic imaging (as per recommen- dation 4) of first-degree relatives is recom- mended.13",isselbacher-et-al-2022-acc-aha-guideline-for-the-diagnosis-and-management-of-aortic-disease-a-report-of-the-american.pdf
id_02228,2022,30,Class 1,C-LD,"In asymptomatic patients with aneurysms of the aortic root or ascending aorta with nonsyndromic heritable thoracic aortic dis- ease (nsHTAD) and no identified genetic cause, determining the timing of surgical repair requires shared decision-making and is informed by known aortic diameters at the time of aortic dissection, TAA repair, or both in affected family members.1-4",isselbacher-et-al-2022-acc-aha-guideline-for-the-diagnosis-and-management-of-aortic-disease-a-report-of-the-american.pdf
id_02229,2022,30,Class 1,C-LD,In asymptomatic patients with aneurysms of the aortic root or ascending aorta with nsHTAD and no identified genetic cause but no information on aortic diameters at the time of dissection or aneurysm repair in affected family members and who have no high-risk features for adverse aortic events (Table 9) it is recommended to repair the aorta when the maximal diameter reaches ≥5.0 cm.1,isselbacher-et-al-2022-acc-aha-guideline-for-the-diagnosis-and-management-of-aortic-disease-a-report-of-the-american.pdf
id_02230,2022,30,2A,C-LD,"In patients with aneurysms of the aortic root or ascending aorta with nsHTAD and no identified genetic cause and a maximal aortic diameter of ≥4.5 cm, who have high-risk fea- tures for adverse aortic events (Table 9), or who are undergoing cardiac surgery for other indications, aortic repair is reasonable when performed by experienced surgeons in a Mul- tidisciplinary Aortic Team.5",isselbacher-et-al-2022-acc-aha-guideline-for-the-diagnosis-and-management-of-aortic-disease-a-report-of-the-american.pdf
id_02231,2022,31,Class 1,C-EO,"In patients with Marfan syndrome, a TTE is recommended at the time of initial diagnosis, to determine the diameters of the aortic root and ascending aorta, and 6 months thereafter, to determine the rate of aortic growth; if the aortic diameters are stable, an annual surveillance TTE is recommended.1 If the aortic root, ascending aorta, or both are not adequately visualized on TTE, a CT or MRI of the thoracic aorta is recommended.2",isselbacher-et-al-2022-acc-aha-guideline-for-the-diagnosis-and-management-of-aortic-disease-a-report-of-the-american.pdf
id_02232,2022,31,2A,C-EO,"In adults with Marfan syndrome, after the initial TTE, a CT or MRI of the thoracic aorta is reasonable to confirm the aortic diameters and assess the remainder of the thoracic aorta. Downloaded from http://ahajournals.org by on June 19, 2025",isselbacher-et-al-2022-acc-aha-guideline-for-the-diagnosis-and-management-of-aortic-disease-a-report-of-the-american.pdf
id_02233,2022,32,Class 1,C-LD,"In patients with Marfan syndrome who have undergone aortic root replacement, surveil- lance imaging of the thoracic aorta by MRI (or CT) is recommended to evaluate for distal TAD, initially annually and then, if normal in diameter and unchanged after 2 years, every other year.3-6",isselbacher-et-al-2022-acc-aha-guideline-for-the-diagnosis-and-management-of-aortic-disease-a-report-of-the-american.pdf
id_02234,2022,32,2A,C-LD,"In patients with Marfan syndrome who have undergone aortic root replacement, surveil- lance imaging every 3 to 5 years for potential AAA is reasonable.2,6",isselbacher-et-al-2022-acc-aha-guideline-for-the-diagnosis-and-management-of-aortic-disease-a-report-of-the-american.pdf
id_02235,2022,32,Class 1,A,"In patients with Marfan syndrome, treatment with either a beta blocker or an ARB, in maxi- mally tolerated doses (unless contraindicated), is recommended to reduce the rate of aortic dilation.1,2",isselbacher-et-al-2022-acc-aha-guideline-for-the-diagnosis-and-management-of-aortic-disease-a-report-of-the-american.pdf
id_02236,2022,32,2A,C-LD,"In patients with Marfan syndrome, the use of both a beta blocker and an ARB, in maximally tolerated doses (unless contraindicated), is reasonable to reduce the rate of aortic dila- tion.3,4",isselbacher-et-al-2022-acc-aha-guideline-for-the-diagnosis-and-management-of-aortic-disease-a-report-of-the-american.pdf
id_02237,2022,33,Class 1,B-NR,"In patients with Marfan syndrome and an aortic root diameter of ≥5.0 cm, surgery to replace the aortic root and ascending aorta is recommended.1-4",isselbacher-et-al-2022-acc-aha-guideline-for-the-diagnosis-and-management-of-aortic-disease-a-report-of-the-american.pdf
id_02238,2022,33,2A,B-NR,"In patients with Marfan syndrome, an aortic root diameter of ≥4.5 cm, and features associ- ated with an increased risk of aortic dissection (see Table 10), surgery to replace the aortic root and ascending aorta is reasonable, when performed by experienced surgeons in a Mul- tidisciplinary Aortic Team.1,3,4",isselbacher-et-al-2022-acc-aha-guideline-for-the-diagnosis-and-management-of-aortic-disease-a-report-of-the-american.pdf
id_02239,2022,33,2A,C-LD,"In patients with Marfan syndrome and a maxi- mal cross-sectional aortic root area (cm2) to patient height (m) ratio of ≥10, surgery to replace the aortic root and ascending aorta is reasonable, when performed by experienced surgeons in a Multidisciplinary Aortic Team.5",isselbacher-et-al-2022-acc-aha-guideline-for-the-diagnosis-and-management-of-aortic-disease-a-report-of-the-american.pdf
id_02240,2022,33,2B,C-LD,"In patients with Marfan syndrome and an aor- tic diameter approaching surgical threshold, who are candidates for valve-sparing root replacement (VSRR) and have a very low surgical risk, surgery to replace the aortic root and ascending aorta may be reasonable when performed by experienced surgeons in a Mul- tidisciplinary Aortic Team.2-4",isselbacher-et-al-2022-acc-aha-guideline-for-the-diagnosis-and-management-of-aortic-disease-a-report-of-the-american.pdf
id_02241,2022,34,2A,C-EO,"In patients with Marfan syndrome and a nondissected aneurysm of the aortic arch, descending thoracic aorta, or abdominal aorta of ≥5.0 cm, surgical intervention to replace the aneurysmal segment is ­reasonable.",isselbacher-et-al-2022-acc-aha-guideline-for-the-diagnosis-and-management-of-aortic-disease-a-report-of-the-american.pdf
id_02242,2022,34,Class 1,C-EO,"In patients with Loeys-Dietz syndrome, a baseline TTE is recommended to determine the diameters of the aortic root and ascending aorta, and 6 months thereafter to determine the rate of aortic growth; if the aortic diam- eters are stable, annual surveillance TTE is recommended.1-3",isselbacher-et-al-2022-acc-aha-guideline-for-the-diagnosis-and-management-of-aortic-disease-a-report-of-the-american.pdf
id_02243,2022,34,Class 1,C-EO,"In patients with Loeys-Dietz syndrome and a dilated or dissected aorta and/or arterial branches at baseline, annual surveillance imaging of the affected aorta and arteries with MRI or CT is recommended.1",isselbacher-et-al-2022-acc-aha-guideline-for-the-diagnosis-and-management-of-aortic-disease-a-report-of-the-american.pdf
id_02244,2022,34,Class 1,C-LD,"In patients with Loeys-Dietz syndrome, a baseline MRI or CT from head to pelvis is recommended to evaluate the entire aorta and its branches for aneurysm, dissection, and tortuosity.1-4",isselbacher-et-al-2022-acc-aha-guideline-for-the-diagnosis-and-management-of-aortic-disease-a-report-of-the-american.pdf
id_02245,2022,34,2A,C-EO,"In patients with Loeys-Dietz syndrome with- out dilation of the aorta distal to the aortic root or ascending aorta and without dilated or dissected arterial branches, surveillance imaging from chest to pelvis with MRI (or CT) every 2 years is reasonable, but imaging may be more frequent depending on family ­history.",isselbacher-et-al-2022-acc-aha-guideline-for-the-diagnosis-and-management-of-aortic-disease-a-report-of-the-american.pdf
id_02246,2022,34,2A,C-EO,"In patients with Loeys-Dietz syndrome with- out dilation of the cerebral arteries on initial screening, periodic imaging surveillance for cerebral aneurysms with MRI or CT every 2 to",isselbacher-et-al-2022-acc-aha-guideline-for-the-diagnosis-and-management-of-aortic-disease-a-report-of-the-american.pdf
id_02247,2022,35,2A,C-EO,"In patients with Loeys-Dietz syndrome, treat- ment with a beta blocker or an ARB (unless contraindicated), or both, in maximally toler- ated doses, is reasonable.",isselbacher-et-al-2022-acc-aha-guideline-for-the-diagnosis-and-management-of-aortic-disease-a-report-of-the-american.pdf
id_02248,2022,36,Class 1,C-LD,"In patients with Loeys-Dietz syndrome and aortic dilation, the surgical threshold for prophylactic aortic root and ascending aortic replacement should be informed by the spe- cific genetic variant, aortic diameter, aortic growth rate, extra-aortic features, family his- tory, patient age and sex, and physician and patient preferences (Table 11).1-9",isselbacher-et-al-2022-acc-aha-guideline-for-the-diagnosis-and-management-of-aortic-disease-a-report-of-the-american.pdf
id_02249,2022,36,2B,C-EO,"In patients with Loeys-Dietz syndrome attrib- utable to a pathogenic variant in TGFBR1, TGFBR2, or SMAD3, surgery to replace the intact aortic arch, descending aorta, or abdominal aorta at a diameter of ≥4.5 cm may be considered, with the specific genetic variant, patient age, aortic growth rate, family history, presence of high-risk features (Table 11), and surgical risk informing the decision.",isselbacher-et-al-2022-acc-aha-guideline-for-the-diagnosis-and-management-of-aortic-disease-a-report-of-the-american.pdf
id_02250,2022,37,Class 1,B-NR,"In patients with Turner syndrome, TTE and cardiac MRI are recommended at the time of diagnosis to evaluate for BAV, aortic root and ascending aortic dilation, aortic coarctation, and other congenital heart defects.1-9",isselbacher-et-al-2022-acc-aha-guideline-for-the-diagnosis-and-management-of-aortic-disease-a-report-of-the-american.pdf
id_02251,2022,37,Class 1,B-NR,"In patients with Turner syndrome who are ≥15 years old, the use of the ASI (ratio of aortic diameter [cm] to BSA [m2]) is recommended to define the degree of aortic dilation and assess the risk of aortic ­dissection.9,10,11",isselbacher-et-al-2022-acc-aha-guideline-for-the-diagnosis-and-management-of-aortic-disease-a-report-of-the-american.pdf
id_02252,2022,37,Class 1,C-LD,"In patients with Turner syndrome without risk factors for aortic dissection (Table 12), sur- veillance imaging with TTE or MRI to evalu- ate the aorta is recommended every 5 years in children and every 10 years in adults, as well as before planning a ­pregnancy.9,10,11",isselbacher-et-al-2022-acc-aha-guideline-for-the-diagnosis-and-management-of-aortic-disease-a-report-of-the-american.pdf
id_02253,2022,37,Class 1,C-EO,"In patients with Turner syndrome and an ASI >2.3 cm/m2, surveillance imaging of the aorta is recommended at least ­annually.9 Downloaded from http://ahajournals.org by on June 19, 2025",isselbacher-et-al-2022-acc-aha-guideline-for-the-diagnosis-and-management-of-aortic-disease-a-report-of-the-american.pdf
id_02254,2022,38,Class 1,C-EO,"In patients with Turner syndrome and risk factors for aortic dissection (Table 12), surveil- lance aortic imaging at an interval depending on the aortic diameter, ASI, and aortic growth rate is recommended (­Figure 18).9",isselbacher-et-al-2022-acc-aha-guideline-for-the-diagnosis-and-management-of-aortic-disease-a-report-of-the-american.pdf
id_02255,2022,38,2A,C-LD,"In patients with Turnery syndrome who are ≥15 years old and have an ASI of ≥2.5 cm/m2 plus risk factors for aortic dissection (Table 12), surgical intervention to replace the aortic root, ascending aorta, or both is reasonable.9,10",isselbacher-et-al-2022-acc-aha-guideline-for-the-diagnosis-and-management-of-aortic-disease-a-report-of-the-american.pdf
id_02256,2022,40,Class 1,B-NR,"In patients with a BAV, TTE is indicated to evaluate valve morphology and function, to evaluate the diameter of the aortic root and ascending aorta, and to evaluate for aortic coarctation and other associated cardiovascu- lar defects.1-4",isselbacher-et-al-2022-acc-aha-guideline-for-the-diagnosis-and-management-of-aortic-disease-a-report-of-the-american.pdf
id_02257,2022,40,Class 1,C-LD,"In patients with a BAV, CT or MRI of the tho- racic aorta is indicated when the diameter and morphology of the aortic root, ascending aorta, or both cannot be assessed accurately or completely by TTE.1",isselbacher-et-al-2022-acc-aha-guideline-for-the-diagnosis-and-management-of-aortic-disease-a-report-of-the-american.pdf
id_02258,2022,40,Class 1,C-LD,"In patients with a BAV and either HTAD or phenotypic features concerning for Loeys- Dietz syndrome, a medical genetics evaluation is recommended.5,6",isselbacher-et-al-2022-acc-aha-guideline-for-the-diagnosis-and-management-of-aortic-disease-a-report-of-the-american.pdf
id_02259,2022,40,Class 1,C-LD,"In patients with a BAV and a dilated aortic root or ascending aorta, screening of all first- degree relatives by TTE is recommended to evaluate for the presence of a BAV, dilation of the aortic root and ascending aorta, or both; if the diameter and morphology of the aortic root, ascending aorta, or both cannot be assessed accurately or completely by TTE, a cardiac-gated CT or MRI of the thoracic aorta is indicated.7",isselbacher-et-al-2022-acc-aha-guideline-for-the-diagnosis-and-management-of-aortic-disease-a-report-of-the-american.pdf
