id,Year,Page,COR,LOE,Recommendation,SourceFile
id_00001,2024,10,Class 1,C-EO,A first aid provider who is assisting a person with a potentially serious illness or injury should immediately activate the emergency response system.,hewett-brumberg-et-al-2024-american-heart-association-and-american-red-cross-guidelines-for-first-aid.pdf
id_00002,2024,10,Class 1,C-EO,A first aid provider who is assisting a person with a potentially serious illness or injury should remain with the person until trained rescuers arrive as long as it is safe to do so.,hewett-brumberg-et-al-2024-american-heart-association-and-american-red-cross-guidelines-for-first-aid.pdf
id_00003,2024,10,Class 1,C-EO,"If the area is unsafe, the first aid provider should move an ill or injured person to a safe location if possible and safe for the first aid provider to do so.",hewett-brumberg-et-al-2024-american-heart-association-and-american-red-cross-guidelines-for-first-aid.pdf
id_00004,2024,10,Class 1,C-EO,"If a person has been injured, is responsive, and is breathing normally and the nature of the injury suggests a neck, back, hip, or pelvic injury, the person should be left in the position in which they were found to avoid potential further injury unless the area is unsafe.",hewett-brumberg-et-al-2024-american-heart-association-and-american-red-cross-guidelines-for-first-aid.pdf
id_00005,2024,10,Class 1,C-EO,"An awake and alert person who is having difficulty breathing should be allowed to assume a position most comfortable for breathing, which will be sitting up in most situations.",hewett-brumberg-et-al-2024-american-heart-association-and-american-red-cross-guidelines-for-first-aid.pdf
id_00006,2024,10,Class 1,C-EO,Individuals who are ill or injured should be protected from hyperthermia or hypothermia due to exposure.,hewett-brumberg-et-al-2024-american-heart-association-and-american-red-cross-guidelines-for-first-aid.pdf
id_00007,2024,10,2A,C-LD,It is reasonable to position a person with decreased alertness of nontraumatic cause who is breathing normally in a recovery (side-lying) position. Recommendation-Specific Supportive Text,hewett-brumberg-et-al-2024-american-heart-association-and-american-red-cross-guidelines-for-first-aid.pdf
id_00008,2024,12,2A,C-LD,"If a person shows evidence of shock with a normal level of alertness, it is reasonable to place or maintain the person in a supine position.",hewett-brumberg-et-al-2024-american-heart-association-and-american-red-cross-guidelines-for-first-aid.pdf
id_00009,2024,12,2A,C-LD,"If a person showing signs of shock is at risk for airway obstruction (decreased alertness, active vomiting) or cannot be continuously watched, it is reasonable to place the person in the recovery position.",hewett-brumberg-et-al-2024-american-heart-association-and-american-red-cross-guidelines-for-first-aid.pdf
id_00010,2024,12,2B,C-LD,"If there is no evidence of trauma or injury (eg, simple fainting, shock from nontraumatic bleeding, sepsis, dehydration), raising the feet about 6 to 12 in (≈30°–45°) from supine position may be reasonable while awaiting the arrival of EMS.",hewett-brumberg-et-al-2024-american-heart-association-and-american-red-cross-guidelines-for-first-aid.pdf
id_00011,2024,12,2B,C-EO,"If a person is placed in a leg-raised position that results in pain, discomfort, or worsened symptoms, returning the person to a supine position may be considered. Recommendation-Specific Supportive Text",hewett-brumberg-et-al-2024-american-heart-association-and-american-red-cross-guidelines-for-first-aid.pdf
id_00012,2024,13,2B,C-LD,"The effectiveness/usefulness of oxygen adminis- tered in the first aid setting for adults or children exhibiting signs or symptoms of shortness of breath, difficulty breathing, or hypoxia is unknown.",hewett-brumberg-et-al-2024-american-heart-association-and-american-red-cross-guidelines-for-first-aid.pdf
id_00013,2024,13,Class 3: No Benefit,B-R,It is not beneficial to administer oxygen over room air in the first aid setting for adults experiencing acute stroke.,hewett-brumberg-et-al-2024-american-heart-association-and-american-red-cross-guidelines-for-first-aid.pdf
id_00014,2024,14,Class 1,C-EO,A physical examination and history should be the primary assessment methods for first aid provid- ers to evaluate an ill or injured person.,hewett-brumberg-et-al-2024-american-heart-association-and-american-red-cross-guidelines-for-first-aid.pdf
id_00015,2024,14,2A,C-EO,It is reasonable for first aid providers to use pulse oximetry results in the context of a complete assessment and to be aware of the limitations of pulse oximetry before acting on any results. Recommendation-Specific Supportive Text,hewett-brumberg-et-al-2024-american-heart-association-and-american-red-cross-guidelines-for-first-aid.pdf
id_00016,2024,15,Class 1,B-R,First aid providers should assist a person with asthma who is having difficulty breathing with the administration of their own prescribed bronchodilators as needed.,hewett-brumberg-et-al-2024-american-heart-association-and-american-red-cross-guidelines-for-first-aid.pdf
id_00017,2024,15,2A,B-R,"It is reasonable to use either an inhaler with a spacer or a nebulizer when assisting a person with asthma to use their own inhaled bronchodilator medication, in preference to using an inhaler alone.",hewett-brumberg-et-al-2024-american-heart-association-and-american-red-cross-guidelines-for-first-aid.pdf
id_00018,2024,15,2A,B-R,"If a commercially available spacer is not available, it is reasonable to use an improvised spacer when assisting a person who is having an asthma attack to use their own inhaled bronchodilator medication. Recommendation-Specific Supportive Text",hewett-brumberg-et-al-2024-american-heart-association-and-american-red-cross-guidelines-for-first-aid.pdf
id_00019,2024,16,Class 1,B-NR,"If stroke is suspected, the EMS system should be activated immediately.",hewett-brumberg-et-al-2024-american-heart-association-and-american-red-cross-guidelines-for-first-aid.pdf
id_00020,2024,16,Class 1,B-NR,"The use of a stroke recognition scale such as the Face, Arms, Speech, Time (FAST) or Cincinnati Prehospital Stroke Scale is recommended to aid in the recognition of acute stroke in adults.",hewett-brumberg-et-al-2024-american-heart-association-and-american-red-cross-guidelines-for-first-aid.pdf
id_00021,2024,16,2A,C-EO,It is reasonable for first aid providers to measure capillary blood glucose in adults with suspected stroke if it is available and does not delay activating EMS. Recommendation-Specific Supportive Text,hewett-brumberg-et-al-2024-american-heart-association-and-american-red-cross-guidelines-for-first-aid.pdf
id_00022,2024,18,Class 1,B-NR,"If pediatric stroke is suspected, EMS should be activated, and the person should be transported to an ED.",hewett-brumberg-et-al-2024-american-heart-association-and-american-red-cross-guidelines-for-first-aid.pdf
id_00023,2024,18,2A,C-EO,It is reasonable to consider stroke when common pediatric symptoms are present in association with other neurological signs and symptoms.,hewett-brumberg-et-al-2024-american-heart-association-and-american-red-cross-guidelines-for-first-aid.pdf
id_00024,2024,18,Class 3: No Benefit,C-EO,Adult stroke scores are not validated in the pediatric population and should not solely be used to identify the broad presentation of stroke in children. Recommendation-Specific Supportive Text,hewett-brumberg-et-al-2024-american-heart-association-and-american-red-cross-guidelines-for-first-aid.pdf
id_00025,2024,19,Class 1,C-LD,"In adults with acute chest pain, the emergency response system should be activated to initiate transport to the closest ED by EMS.",hewett-brumberg-et-al-2024-american-heart-association-and-american-red-cross-guidelines-for-first-aid.pdf
id_00026,2024,19,2B,B-NR,"While awaiting the arrival of EMS, first aid provid- ers may encourage alert adults experiencing non- traumatic chest pain to chew and swallow aspirin (162–325 mg), unless the person experiencing pain has a known aspirin allergy or has been advised by a health care professional not to take aspirin.",hewett-brumberg-et-al-2024-american-heart-association-and-american-red-cross-guidelines-for-first-aid.pdf
id_00027,2024,19,2B,C-EO,"If there is any uncertainty that aspirin should be taken, it is reasonable to wait for EMS arrival without administration of aspirin. Recommendation-Specific Supportive Text",hewett-brumberg-et-al-2024-american-heart-association-and-american-red-cross-guidelines-for-first-aid.pdf
id_00028,2024,20,Class 1,B-NR,"If a person experiences anaphylaxis and an epinephrine autoinjector is available, the person should self-administer the autoinjector.",hewett-brumberg-et-al-2024-american-heart-association-and-american-red-cross-guidelines-for-first-aid.pdf
id_00029,2024,20,Class 1,C-EO,A first aid provider should assist a person experi- encing anaphylaxis to use their autoinjector if assistance is required.,hewett-brumberg-et-al-2024-american-heart-association-and-american-red-cross-guidelines-for-first-aid.pdf
id_00030,2024,20,Class 1,C-EO,"If a person experiences anaphylaxis, the emer- gency response system should be activated.",hewett-brumberg-et-al-2024-american-heart-association-and-american-red-cross-guidelines-for-first-aid.pdf
id_00031,2024,20,2B,B-NR,"If a person with anaphylaxis does not respond to the initial dose of epinephrine and arrival of EMS will exceed 5 to 10 minutes, a repeat dose may be considered. Recommendation-Specific Supportive Text",hewett-brumberg-et-al-2024-american-heart-association-and-american-red-cross-guidelines-for-first-aid.pdf
id_00032,2024,21,Class 1,C-LD,"First aid providers should activate EMS for individuals with first-time seizure; seizures last- ing >5 minutes; >1 seizure that occurs without the person returning to baseline mental status in between; seizures occurring in the water; seizures with traumatic injuries, difficulty breathing, or choking; seizure in an infant <6 months of age; seizure in pregnant individuals; or if the individual does not return to baseline within 5 to 10 minutes once seizure activity has stopped.",hewett-brumberg-et-al-2024-american-heart-association-and-american-red-cross-guidelines-for-first-aid.pdf
id_00033,2024,21,Class 1,C-EO,"First aid providers should minimize the risk of injury to the individual who is having a seizure by helping the person to the ground, placing the person on their side in the recovery position, and clearing the area around them.",hewett-brumberg-et-al-2024-american-heart-association-and-american-red-cross-guidelines-for-first-aid.pdf
id_00034,2024,21,Class 1,C-EO,"First aid providers should stay with the person having a seizure. Downloaded from http://ahajournals.org by on June 19, 2025",hewett-brumberg-et-al-2024-american-heart-association-and-american-red-cross-guidelines-for-first-aid.pdf
id_00035,2024,22,Class 3: No Benefit,B-R,"For children who have experienced a febrile seizure, administration of antipyretics such as acetaminophen, ibuprofen, or paracetamol is not effective for stopping a seizure or preventing a subsequent febrile seizure.",hewett-brumberg-et-al-2024-american-heart-association-and-american-red-cross-guidelines-for-first-aid.pdf
id_00036,2024,22,Class 3: Harm,C-EO,The person having the seizure should not be restrained.,hewett-brumberg-et-al-2024-american-heart-association-and-american-red-cross-guidelines-for-first-aid.pdf
id_00037,2024,22,Class 3: Harm,C-EO,"Nothing should be put in the mouth and no food, liquids, or oral medicines should be given to a person who is experiencing a seizure or who has decreased responsiveness after a seizure. Recommendation-Specific Supportive Text",hewett-brumberg-et-al-2024-american-heart-association-and-american-red-cross-guidelines-for-first-aid.pdf
id_00038,2024,23,Class 1,C-LD,"For a person with suspected hypoglycemia who is awake and able to swallow, the first aid provider should encourage the person to swallow oral glucose.",hewett-brumberg-et-al-2024-american-heart-association-and-american-red-cross-guidelines-for-first-aid.pdf
id_00039,2024,23,Class 1,C-EO,"EMS should be activated for a person with hypoglycemia who is unable to swallow, has a seizure, or does not improve within 10 minutes of oral glucose administration.",hewett-brumberg-et-al-2024-american-heart-association-and-american-red-cross-guidelines-for-first-aid.pdf
id_00040,2024,23,2A,B-NR,"If they are available, it is reasonable to use oral glucose tablets in preference to gel or dietary sources of glucose to treat hypoglycemia.",hewett-brumberg-et-al-2024-american-heart-association-and-american-red-cross-guidelines-for-first-aid.pdf
id_00041,2024,23,2A,C-LD,It is reasonable to use simple dietary sugars as an alternative if glucose tablets or gel is not available to treat hypoglycemia.,hewett-brumberg-et-al-2024-american-heart-association-and-american-red-cross-guidelines-for-first-aid.pdf
id_00042,2024,23,2B,C-LD,"For children with suspected hypoglycemia who are awake but unwilling or unable to swallow glucose, it may be reasonable to apply a slurry of granulated sugar and water under the tongue.",hewett-brumberg-et-al-2024-american-heart-association-and-american-red-cross-guidelines-for-first-aid.pdf
id_00043,2024,25,Class 1,C-LD,"If a person experiences signs or symptoms of presyncope (including pallor, sweating, lightheadedness, visual changes, and weakness) of vasovagal or orthostatic origin, that person should maintain or assume a safe position such as assisted sitting or lying down.",hewett-brumberg-et-al-2024-american-heart-association-and-american-red-cross-guidelines-for-first-aid.pdf
id_00044,2024,25,2A,C-LD,"Once the person with presyncope is in a safe position, it can be beneficial for that person to use physical PCMs to avoid syncope.",hewett-brumberg-et-al-2024-american-heart-association-and-american-red-cross-guidelines-for-first-aid.pdf
id_00045,2024,25,2B,C-LD,Lower-body PCMs may be preferable to upper-body and abdominal PCMs in first aid for presyncope.,hewett-brumberg-et-al-2024-american-heart-association-and-american-red-cross-guidelines-for-first-aid.pdf
id_00046,2024,25,2B,C-EO,"If no improvement occurs within 1 to 2 minutes, if syncope occurs, or if symptoms worsen or reoccur, the first aid provider should activate emergency services.",hewett-brumberg-et-al-2024-american-heart-association-and-american-red-cross-guidelines-for-first-aid.pdf
id_00047,2024,26,Class 1,B-NR,"If a person experiences anaphylaxis due to a bee, wasp, or hornet sting and an epinephrine autoinjector is available, the person should self-administer the autoinjector.",hewett-brumberg-et-al-2024-american-heart-association-and-american-red-cross-guidelines-for-first-aid.pdf
id_00048,2024,26,Class 1,C-EO,A first aid provider should assist a person experiencing anaphylaxis to use the autoinjector if assistance is required.,hewett-brumberg-et-al-2024-american-heart-association-and-american-red-cross-guidelines-for-first-aid.pdf
id_00049,2024,26,Class 1,C-EO,"If a person experiences anaphylaxis due to a bee, wasp, or hornet sting, the emergency response system should be activated.",hewett-brumberg-et-al-2024-american-heart-association-and-american-red-cross-guidelines-for-first-aid.pdf
id_00050,2024,26,Class 1,C-EO,Stings to the eye should be evaluated by a trained medical professional.,hewett-brumberg-et-al-2024-american-heart-association-and-american-red-cross-guidelines-for-first-aid.pdf
id_00051,2024,26,2A,B-NR,Removal of a stinger remaining in the skin as soon as possible by plucking or scraping can be beneficial.,hewett-brumberg-et-al-2024-american-heart-association-and-american-red-cross-guidelines-for-first-aid.pdf
id_00052,2024,26,2A,C-EO,Over-the-counter oral antihistamines can be used to alleviate local itching.,hewett-brumberg-et-al-2024-american-heart-association-and-american-red-cross-guidelines-for-first-aid.pdf
id_00053,2024,26,2A,C-EO,Topical corticosteroids can be used to alleviate local itching.,hewett-brumberg-et-al-2024-american-heart-association-and-american-red-cross-guidelines-for-first-aid.pdf
id_00054,2024,26,2A,C-EO,"It is reasonable to wash the area of a bee, wasp, or hornet sting with soap and water.",hewett-brumberg-et-al-2024-american-heart-association-and-american-red-cross-guidelines-for-first-aid.pdf
id_00055,2024,26,2B,C-EO,Administration of over-the-counter acetaminophen and nonsteroidal anti-inflammatory agents may be considered to alleviate local pain.,hewett-brumberg-et-al-2024-american-heart-association-and-american-red-cross-guidelines-for-first-aid.pdf
id_00056,2024,26,2B,C-EO,Administration of ice or cold packs may be con- sidered for local pain relief. Recommendation-Specific Supportive Text,hewett-brumberg-et-al-2024-american-heart-association-and-american-red-cross-guidelines-for-first-aid.pdf
id_00057,2024,28,Class 1,B-R,Tick bites occurring in regions with high prevalence of Lyme disease should receive prompt consultation with a health care professional within 72 hours after removal of an engorged tick.,hewett-brumberg-et-al-2024-american-heart-association-and-american-red-cross-guidelines-for-first-aid.pdf
id_00058,2024,28,Class 1,B-NR,We recommend removal of a tick as soon as possible.,hewett-brumberg-et-al-2024-american-heart-association-and-american-red-cross-guidelines-for-first-aid.pdf
id_00059,2024,28,Class 1,C-LD,"To remove a tick, we recommend grasping the head of the tick as close to the skin as possible with tweezers or a commercial tick removal device and pulling upward with steady, even pressure. Recommendation-Specific Supportive Text",hewett-brumberg-et-al-2024-american-heart-association-and-american-red-cross-guidelines-for-first-aid.pdf
id_00060,2024,29,Class 1,B-NR,"As soon as exposure to poison ivy, oak, or sumac is recognized, the exposed area should be washed with soap and water or a commercially available decontamination product.",hewett-brumberg-et-al-2024-american-heart-association-and-american-red-cross-guidelines-for-first-aid.pdf
id_00061,2024,29,2B,B-NR,"The usefulness of over-the-counter topical steroids to alleviate local symptoms from poison ivy, oak, or sumac is uncertain.",hewett-brumberg-et-al-2024-american-heart-association-and-american-red-cross-guidelines-for-first-aid.pdf
id_00062,2024,29,2B,C-EO,"Cool compresses may be considered for relief of local symptoms from exposure to poison ivy, oak, or sumac.",hewett-brumberg-et-al-2024-american-heart-association-and-american-red-cross-guidelines-for-first-aid.pdf
id_00063,2024,29,2B,C-EO,"Oatmeal baths may be considered for relief of local symptoms from exposure to poison ivy, oak, or sumac.",hewett-brumberg-et-al-2024-american-heart-association-and-american-red-cross-guidelines-for-first-aid.pdf
id_00064,2024,29,2B,C-EO,"The usefulness of over-the-counter antihistamines to alleviate local symptoms from poison ivy, oak, or sumac is uncertain. Recommendation-Specific Supportive Text",hewett-brumberg-et-al-2024-american-heart-association-and-american-red-cross-guidelines-for-first-aid.pdf
id_00065,2024,30,Class 1,C-EO,Emergency services should be activated for any person bitten by a venomous or possibly venomous snake.,hewett-brumberg-et-al-2024-american-heart-association-and-american-red-cross-guidelines-for-first-aid.pdf
id_00066,2024,30,2A,C-LD,It is reasonable to rest and immobilize the bitten extremity and minimize exertion by the person who was bitten if it does not delay access to emergency medical care.,hewett-brumberg-et-al-2024-american-heart-association-and-american-red-cross-guidelines-for-first-aid.pdf
id_00067,2024,30,2A,C-EO,It is reasonable to remove rings and other con- stricting objects from the bitten extremity.,hewett-brumberg-et-al-2024-american-heart-association-and-american-red-cross-guidelines-for-first-aid.pdf
id_00068,2024,30,Class 3: No Benefit,C-LD,Application of ice to a snakebite wound is of unproven benefit and may be harmful in some situations.,hewett-brumberg-et-al-2024-american-heart-association-and-american-red-cross-guidelines-for-first-aid.pdf
id_00069,2024,32,Class 1,C-EO,"A first aid provider should observe a person with a jellyfish sting for systemic reaction and call emergency services for difficulty breathing, signs of shock, or severe pain.",hewett-brumberg-et-al-2024-american-heart-association-and-american-red-cross-guidelines-for-first-aid.pdf
id_00070,2024,32,2A,C-LD,It is reasonable to remove any remaining tentacles by lifting or pulling while avoiding manual contact. Rinsing the affected area with seawater to remove the tentacle is a reasonable alternative if mechanical removal is not available.,hewett-brumberg-et-al-2024-american-heart-association-and-american-red-cross-guidelines-for-first-aid.pdf
id_00071,2024,32,2A,C-LD,"After removal of tentacles, it is reasonable to use nonscalding hot water immersion/irrigation or to apply a heat source to relieve pain.",hewett-brumberg-et-al-2024-american-heart-association-and-american-red-cross-guidelines-for-first-aid.pdf
id_00072,2024,32,2B,C-LD,Topical lidocaine cream or gel may be reasonable for pain control if hot water is not available. Recommendation-Specific Supportive Text,hewett-brumberg-et-al-2024-american-heart-association-and-american-red-cross-guidelines-for-first-aid.pdf
id_00073,2024,33,Class 1,C-EO,"Emergency services should be called if a person bitten by a spider or stung by a scorpion develops symptoms throughout the body such as difficulty breathing, muscle rigidity, dizziness, or confusion.",hewett-brumberg-et-al-2024-american-heart-association-and-american-red-cross-guidelines-for-first-aid.pdf
id_00074,2024,33,Class 1,C-EO,"A person bitten by a spider or stung by a scorpion should seek medical care if pain extends beyond the site of the bite/sting, becomes severe, and is not controlled by over-the-counter pain medica- tions; if an open wound develops; or if the person experiences symptoms throughout the body.",hewett-brumberg-et-al-2024-american-heart-association-and-american-red-cross-guidelines-for-first-aid.pdf
id_00075,2024,33,2A,C-LD,Over-the-counter acetaminophen and nonsteroi- dal anti-inflammatory agents can be used to allevi- ate local pain from scorpion stings.,hewett-brumberg-et-al-2024-american-heart-association-and-american-red-cross-guidelines-for-first-aid.pdf
id_00076,2024,33,2A,C-LD,"If the skin is intact, topical lidocaine can be useful to relieve local pain from scorpion stings.",hewett-brumberg-et-al-2024-american-heart-association-and-american-red-cross-guidelines-for-first-aid.pdf
id_00077,2024,33,2A,C-LD,Ice can be useful for local pain relief from scor- pion stings. Recommendation-Specific Supportive Text,hewett-brumberg-et-al-2024-american-heart-association-and-american-red-cross-guidelines-for-first-aid.pdf
id_00078,2024,34,Class 1,B-R,"A person with signs and symptoms of hypother- mia should be protected from further heat loss by moving from the cold environment to a warm one, having saturated clothing removed, being allowed to passively rewarm with blankets, and being actively rewarmed if resources are available.",hewett-brumberg-et-al-2024-american-heart-association-and-american-red-cross-guidelines-for-first-aid.pdf
id_00079,2024,34,Class 1,C-LD,"If a person with hypothermia cannot be immedi- ately moved from a cold environment to a warm one, they should be protected from further heat loss by insulation from the ground, covering of head and neck, and shielding from heat loss by wind using a plastic or foil layer in addition to a dry insulating layer.",hewett-brumberg-et-al-2024-american-heart-association-and-american-red-cross-guidelines-for-first-aid.pdf
id_00080,2024,34,Class 1,C-LD,"When using rewarming devices of any kind, the first aid provider should follow the manufacturer’s instructions for the device used, place insulation between the heat source and skin, and frequently monitor for burns and pressure injury.",hewett-brumberg-et-al-2024-american-heart-association-and-american-red-cross-guidelines-for-first-aid.pdf
id_00081,2024,34,Class 1,C-EO,"If a person with hypothermia has a decreased level of responsiveness such as unresponsive- ness, inability to remain awake, mumbling speech, confusion, or inability to participate in removal of clothing or has pallor, cyanosis, or frozen skin, the emergency response system should be activated while the person is rewarmed by any available method.",hewett-brumberg-et-al-2024-american-heart-association-and-american-red-cross-guidelines-for-first-aid.pdf
id_00082,2024,34,Class 1,C-EO,"For patients experiencing cold stress or mild hypothermia who are alert and can safely con- sume oral food or fluids, it is recommended to provide high-calorie foods or drinks.",hewett-brumberg-et-al-2024-american-heart-association-and-american-red-cross-guidelines-for-first-aid.pdf
id_00083,2024,34,2A,C-LD,"If a person with hypothermia with a decreased level of responsiveness is wearing damp (not saturated) clothing such as polyester fleece and cannot be immediately moved into a warm environment, active rewarming through the damp clothing is reasonable to initiate with the hypo- thermia wrap technique, using chemical heat blankets, plastic or foil layers, and insulative blankets.",hewett-brumberg-et-al-2024-american-heart-association-and-american-red-cross-guidelines-for-first-aid.pdf
id_00084,2024,34,Class 3: No Benefit,C-LD,It is not beneficial to use body-to-body rewarming for active rewarming over other active rewarming techniques such as chemical heat packs or forced air systems.,hewett-brumberg-et-al-2024-american-heart-association-and-american-red-cross-guidelines-for-first-aid.pdf
id_00085,2024,34,Class 3: No Benefit,C-EO,It is not effective to treat a person with hypothermia by using small glove or boot insert chemical heat packs as the sole or primary means of rewarming.,hewett-brumberg-et-al-2024-american-heart-association-and-american-red-cross-guidelines-for-first-aid.pdf
