id,Year,Page,COR,LOE,Recommendation,SourceFile
id_01522,2023,67,2A,B-R,"In adults with CCD and HIV, it is reasonable to choose antiretroviral therapy regimens associated with more favorable lipid and cardiovascular risk pro- files with consideration of drug-drug interactions.3–5",virani-et-al-2023-aha-acc-accp-aspc-nla-pcna-guideline-for-the-management-of-patients-with-chronic-coronary-disease-a.pdf
id_01523,2023,67,Class 3: Harm,C-LD,"In adults with CCD and HIV, lovastatin or simvastatin should not be administered with protease inhibitors as this may cause harm.6,7 Autoimmune Disorders in CCD",virani-et-al-2023-aha-acc-accp-aspc-nla-pcna-guideline-for-the-management-of-patients-with-chronic-coronary-disease-a.pdf
id_01524,2023,67,2A,C-LD,"In adults with CCD and rheumatoid arthritis, initia- tion and maintenance of disease-modifying anti- rheumatoid drugs is beneficial to decrease the risk of cardiovascular events.8–11",virani-et-al-2023-aha-acc-accp-aspc-nla-pcna-guideline-for-the-management-of-patients-with-chronic-coronary-disease-a.pdf
id_01525,2023,67,2B,C-LD,"In adults with CCD and autoimmune diseases, treatment with biologics and other immune modu- lating therapies that reduce disease activity may be considered to decrease the risk of cardiovascular events.10,11",virani-et-al-2023-aha-acc-accp-aspc-nla-pcna-guideline-for-the-management-of-patients-with-chronic-coronary-disease-a.pdf
id_01526,2023,67,Class 3: Harm,C-LD,"In patients with CCD and rheumatoid arthritis, high- dose glucocorticoids should not be used long term if alternative therapies are available because of increased cardiovascular risk.11,12",virani-et-al-2023-aha-acc-accp-aspc-nla-pcna-guideline-for-the-management-of-patients-with-chronic-coronary-disease-a.pdf
id_01527,2023,69,Class 1,C-LD,"In patients with cardiac allograft vasculopathy, statins are recommended for secondary prevention to reduce MACE.1",virani-et-al-2023-aha-acc-accp-aspc-nla-pcna-guideline-for-the-management-of-patients-with-chronic-coronary-disease-a.pdf
id_01528,2023,69,2A,C-LD,"In patients with cardiac allograft vasculopathy, aspirin can be beneficial for secondary prevention to reduce MACE.2",virani-et-al-2023-aha-acc-accp-aspc-nla-pcna-guideline-for-the-management-of-patients-with-chronic-coronary-disease-a.pdf
id_01529,2023,69,2A,C-LD,"In patients with severe cardiac allograft vasculopathy, revascularization is reasonable in those with suitable anatomy to potentially mitigate the adverse long-term consequences of cardiac allograft vasculopathy.*3–6 *Modified from the 2021 ACC/AHA/SCAI Guideline for Coronary Artery Re- vascularization.7",virani-et-al-2023-aha-acc-accp-aspc-nla-pcna-guideline-for-the-management-of-patients-with-chronic-coronary-disease-a.pdf
id_01530,2023,71,2B,B-R,"In stable patients with CCD and with previous ACS or coronary revascularization, referral to telehealth programs, community-based programs, or both for lifestyle interventions may be reasonable as an adjunct to usual care to improve management of cardiovascular risk factors.1–7",virani-et-al-2023-aha-acc-accp-aspc-nla-pcna-guideline-for-the-management-of-patients-with-chronic-coronary-disease-a.pdf
id_01531,2023,71,Class 3: No Benefit,B-R,"In patients with CCD without a change in clinical or functional status on optimized GDMT, routine periodic testing with coronary CTA or stress testing with or without imaging is not recommended to guide therapeutic decision-making.8–10",virani-et-al-2023-aha-acc-accp-aspc-nla-pcna-guideline-for-the-management-of-patients-with-chronic-coronary-disease-a.pdf
id_01532,2023,71,Class 3: No Benefit,B-R,"In patients with CCD without a change in clinical or functional status, routine periodic reassessment of LV function is not recommended to guide thera- peutic decision-making.11,12",virani-et-al-2023-aha-acc-accp-aspc-nla-pcna-guideline-for-the-management-of-patients-with-chronic-coronary-disease-a.pdf
id_01533,2023,71,Class 3: Harm,B-NR,"In patients with CCD without a change in clinical or functional status, routine periodic invasive coronary angiography should not be performed to guide therapeutic decision-making.13–17",virani-et-al-2023-aha-acc-accp-aspc-nla-pcna-guideline-for-the-management-of-patients-with-chronic-coronary-disease-a.pdf
id_01534,2023,72,Class 1,B-NR,"When discussing treatment and prevention with patients who have CCD, it is recommended that the health care team discuss out-of-pocket costs for medications at the time of initiating a new med- ication and at least annually thereafter to preempt cost-related nonadherence.1–6",virani-et-al-2023-aha-acc-accp-aspc-nla-pcna-guideline-for-the-management-of-patients-with-chronic-coronary-disease-a.pdf
id_01535,2024,10,2A,B-NR,"In patients with known CVD being considered for NCS, a validated risk-prediction tool can be useful to estimate the risk of perioperative MACE.1–4",thompson-et-al-2024-aha-acc-acs-asnc-hrs-sca-scct-scmr-svm-guideline-for-perioperative-cardiovascular-management-for.pdf
id_01536,2024,12,2A,B-NR,"In patients undergoing elevated-risk NCS, a structured assessment of functional capac­ ity (such as the Duke Activity Status Index [DASI]) is reasonable to stratify the risk of perioperative adverse cardiovascular events.1–8",thompson-et-al-2024-aha-acc-acs-asnc-hrs-sca-scct-scmr-svm-guideline-for-perioperative-cardiovascular-management-for.pdf
id_01537,2024,13,2A,B-NR,"In all patients ≥65 years of age and in those <64 years with perceived frailty who are undergoing elevated-risk NCS, preoperative frailty assessment using a validated tool can be useful for evaluating perioperative risk and guiding management.1–5",thompson-et-al-2024-aha-acc-acs-asnc-hrs-sca-scct-scmr-svm-guideline-for-perioperative-cardiovascular-management-for.pdf
id_01538,2024,14,2A,B-NR,"In patients with known CVD, or age ≥65 years, or age ≥45 years with symptoms suggestive of CVD undergoing elevated-risk NCS, it is reasonable to measure B-type natriuretic peptide (BNP) or N- terminal pro–B-type natriuretic peptide (NT-proBNP) before surgery to supplement evaluation of perioperative risk.1–3",thompson-et-al-2024-aha-acc-acs-asnc-hrs-sca-scct-scmr-svm-guideline-for-perioperative-cardiovascular-management-for.pdf
id_01539,2024,14,2B,B-NR,"In patients with known CVD, or age ≥65 years, or age ≥45 years with symptoms suggestive of CVD undergoing elevated-risk NCS, it may be reasonable to measure cardiac troponin (cTn) before surgery to supplement evaluation of peri­ operative risk.4–6",thompson-et-al-2024-aha-acc-acs-asnc-hrs-sca-scct-scmr-svm-guideline-for-perioperative-cardiovascular-management-for.pdf
id_01540,2024,15,2A,B-NR,"For patients with known coronary heart disease, signifi­ cant arrhythmia, peripheral arterial disease, cerebrovas­ cular disease, other significant structural heart disease, or symptoms* of CVD undergoing elevated-risk sur­ gery, a preoperative resting 12-lead electrocardiogram (ECG) is reasonable to establish a preoperative base­ line and guide perioperative management.1,2",thompson-et-al-2024-aha-acc-acs-asnc-hrs-sca-scct-scmr-svm-guideline-for-perioperative-cardiovascular-management-for.pdf
id_01541,2024,15,2A,B-NR,"In patients undergoing NCS with a preoperative ECG exhibiting new abnormalities,† further evalu­ ation is reasonable to refine assessment of cardio­ vascular risk.3–8",thompson-et-al-2024-aha-acc-acs-asnc-hrs-sca-scct-scmr-svm-guideline-for-perioperative-cardiovascular-management-for.pdf
id_01542,2024,15,2B,B-NR,"For asymptomatic patients undergoing elevated-risk surgeries without known CVD, a preoperative rest­ ing 12-lead ECG may be considered to establish a baseline and guide perioperative management.3,9,10",thompson-et-al-2024-aha-acc-acs-asnc-hrs-sca-scct-scmr-svm-guideline-for-perioperative-cardiovascular-management-for.pdf
id_01543,2024,15,Class 3: No Benefit,B-NR,"For asymptomatic patients undergoing low-risk surgi­ cal procedures, a routine preoperative resting 12-lead ECG is not recommended to improve outcomes.11 *Active symptoms and signs of CVD include chest pain, dyspnea, undiagnosed palpitations, tachycardia, syncope, or murmurs. †Abnormalities may include ST-segment elevation, ST depression, T-wave inversions, left ventricular (LV) hypertrophy, significant pathologic Q-waves, Mo­ bitz type II or higher atrioventricular block, bundle branch block, QT prolonga­ tion, or AF.",thompson-et-al-2024-aha-acc-acs-asnc-hrs-sca-scct-scmr-svm-guideline-for-perioperative-cardiovascular-management-for.pdf
id_01544,2024,16,Class 1,B-NR,"In patients undergoing NCS with new dyspnea, physical examination findings of HF, or suspected new/worsening ventricular dysfunction, it is recom­ mended to perform preoperative evaluation of LV function to help guide perioperative management.1–8",thompson-et-al-2024-aha-acc-acs-asnc-hrs-sca-scct-scmr-svm-guideline-for-perioperative-cardiovascular-management-for.pdf
id_01545,2024,16,2A,C-LD,"In patients with a known diagnosis of HF with wors­ ening dyspnea or other change in clinical status undergoing NCS, preoperative assessment of LV function is reasonable to help guide perioperative management.1,4,7,9–11",thompson-et-al-2024-aha-acc-acs-asnc-hrs-sca-scct-scmr-svm-guideline-for-perioperative-cardiovascular-management-for.pdf
id_01546,2024,16,Class 3: No Benefit,B-NR,"In asymptomatic and clinically stable patients undergo­ ing NCS, routine preoperative evaluation of LV func­ tion is not recommended due to lack of benefit.12–15",thompson-et-al-2024-aha-acc-acs-asnc-hrs-sca-scct-scmr-svm-guideline-for-perioperative-cardiovascular-management-for.pdf
id_01547,2024,17,2B,B-NR,"For patients undergoing elevated-risk NCS with poor or unknown functional capacity and elevated risk for perioperative cardiovascular events based on a validated risk tool, stress testing may be consid­ ered to evaluate for inducible myocardial ischemia.1",thompson-et-al-2024-aha-acc-acs-asnc-hrs-sca-scct-scmr-svm-guideline-for-perioperative-cardiovascular-management-for.pdf
id_01548,2024,17,Class 3: No Benefit,B-R,"In patients who are at low risk for perioperative cardiovascular events, have adequate* functional capacity with stable symptoms, or who are undergo­ ing low-risk procedures, routine stress testing before NCS is not recommended due to lack of benefit.1–3 *Poor functional capacity is considered <4 METs or a DASI score of ≤34.",thompson-et-al-2024-aha-acc-acs-asnc-hrs-sca-scct-scmr-svm-guideline-for-perioperative-cardiovascular-management-for.pdf
id_01549,2024,19,2B,B-NR,"For patients undergoing elevated-risk surgery with poor* or unknown functional capacity, and elevated risk for perioperative cardiovascular events based on a validated risk tool, coronary computed tomog­ raphy angiography (CCTA) for the detection of high-risk coronary anatomy† may be considered.1–4",thompson-et-al-2024-aha-acc-acs-asnc-hrs-sca-scct-scmr-svm-guideline-for-perioperative-cardiovascular-management-for.pdf
id_01550,2024,19,Class 3: No Benefit,B-NR,"In patients who are at low risk for perioperative cardiovascular events, have adequate* functional capacity with stable symptoms, or who are undergo­ ing low-risk procedures, routine CCTA before NCS is not recommended due to lack of benefit.1,5 *Poor functional capacity is considered <4 METs or a DASI score of ≤34. †High-risk coronary anatomy is defined as patients with obstructive stenosis who have ≥50% left main stenosis or anatomically significant 3-vessel disease (≥70% stenosis).6",thompson-et-al-2024-aha-acc-acs-asnc-hrs-sca-scct-scmr-svm-guideline-for-perioperative-cardiovascular-management-for.pdf
id_01551,2024,20,Class 3: No Benefit,C-LD,"In patients undergoing NCS, routine preoperative invasive coronary angiography (ICA) is not recom­ mended to improve perioperative outcomes.1,2",thompson-et-al-2024-aha-acc-acs-asnc-hrs-sca-scct-scmr-svm-guideline-for-perioperative-cardiovascular-management-for.pdf
id_01552,2024,22,Class 1,C-LD,"In patients with ACS being considered for elective NCS, coronary revascularization as appropriate and deferral of surgery is recommended to reduce peri­ operative cardiovascular events.1–9",thompson-et-al-2024-aha-acc-acs-asnc-hrs-sca-scct-scmr-svm-guideline-for-perioperative-cardiovascular-management-for.pdf
id_01553,2024,22,2A,C-LD,"In patients with CCD and hemodynamically signifi­ cant left main coronary artery stenosis ≥50% who are planning elective NCS, coronary revasculariza­ tion and deferral of surgery is reasonable to reduce perioperative cardiovascular events.10,11",thompson-et-al-2024-aha-acc-acs-asnc-hrs-sca-scct-scmr-svm-guideline-for-perioperative-cardiovascular-management-for.pdf
id_01554,2024,22,Class 3: No Benefit,B-R,"In patients with non–left main CAD who are planned for NCS, routine preoperative coronary revascularization is not recommended to reduce perioperative cardiovascular events.*12–15 *Modified from the “2021 ACC/AHA/SCAI Guideline for Coronary Artery Re­ vascularization.”16",thompson-et-al-2024-aha-acc-acs-asnc-hrs-sca-scct-scmr-svm-guideline-for-perioperative-cardiovascular-management-for.pdf
id_01555,2024,23,2A,C-EO,"In most* patients with hypertension planned for elec­ tive NCS, it is reasonable to continue medical therapy for hypertension throughout the perioperative period.†",thompson-et-al-2024-aha-acc-acs-asnc-hrs-sca-scct-scmr-svm-guideline-for-perioperative-cardiovascular-management-for.pdf
id_01556,2024,23,2B,C-LD,"In patients undergoing elective elevated-risk surgery who have cardiovascular risk factors for periopera­ tive complications‡ and recent history of poorly con­ trolled hypertension (systolic blood pressure [SBP] ≥180 mm Hg or diastolic blood pressure [DBP] ≥110 mm Hg before the day of surgery), deferring surgery may be considered to reduce the risk of perioperative complications.†1,2 Intraoperative Blood Pressure Management",thompson-et-al-2024-aha-acc-acs-asnc-hrs-sca-scct-scmr-svm-guideline-for-perioperative-cardiovascular-management-for.pdf
id_01557,2024,23,Class 1,B-NR,"In patients undergoing NCS, maintaining an intraop­ erative mean arterial pressure (MAP) ≥60 to 65 mm Hg or SBP ≥90 mm Hg is recommended to reduce the risk of myocardial injury.3–9 Postoperative Blood Pressure Management",thompson-et-al-2024-aha-acc-acs-asnc-hrs-sca-scct-scmr-svm-guideline-for-perioperative-cardiovascular-management-for.pdf
id_01558,2024,23,Class 1,B-NR,"In patients undergoing NCS, treatment of hypoten­ sion (MAP <60-65 or SBP <90 mm Hg) in the postoperative period is recommended to limit the risk of cardiovascular, cerebrovascular, renal events, and mortality.6",thompson-et-al-2024-aha-acc-acs-asnc-hrs-sca-scct-scmr-svm-guideline-for-perioperative-cardiovascular-management-for.pdf
id_01559,2024,23,Class 1,C-EO,"In patients with hypertension undergoing NCS, it is recommended that preoperative antihypertensive medications be restarted as soon as clinically rea­ sonable to avoid complications from postoperative hypertension. *Caution is advised when continuing antihypertensive therapy in patients with low or low-normal perioperative BPs, older adults (≥65 years),10 and patients in whom the risk for perioperative hypotension is high based on an evaluation of the patient’s overall clinical status, surgery type, and anesthetic plan. †Modified from the “2017 ACC/AHA/AAPA/ABC/ACPM/AGS/APhA/ ASH/ASPC/NMA/PCNA High Blood Pressure Guideline.”11 ‡One or more components of the RCRI: CAD, congestive heart failure, cere­ brovascular accident, baseline serum creatinine >2.0 mg/dL, or preoperative in­ sulin treatment.12",thompson-et-al-2024-aha-acc-acs-asnc-hrs-sca-scct-scmr-svm-guideline-for-perioperative-cardiovascular-management-for.pdf
id_01560,2024,25,Class 1,C-LD,"In patients with HF undergoing elective NCS, sodium-glucose cotransporter-2 inhibitors (SGLT2i) should be withheld for 3 to 4 days* before surgery when feasible to reduce the risk of perioperative metabolic acidosis.1–3",thompson-et-al-2024-aha-acc-acs-asnc-hrs-sca-scct-scmr-svm-guideline-for-perioperative-cardiovascular-management-for.pdf
id_01561,2024,25,2A,C-LD,"In patients with compensated HF undergoing NCS, it is reasonable to continue GDMT (excluding SGLT2i) in the perioperative period, unless contraindicated, to reduce the risk of worsening HF.4–8 *Canagliflozin, dapagliflozin, and empagliflozin should be stopped ≥3 days and ertugliflozin ≥4 days before scheduled surgery.3",thompson-et-al-2024-aha-acc-acs-asnc-hrs-sca-scct-scmr-svm-guideline-for-perioperative-cardiovascular-management-for.pdf
id_01562,2024,26,Class 1,C-LD,"In patients receiving stable doses of targeted medi­ cal therapies* for pulmonary arterial hypertension (PAH) undergoing NCS, it is recommended to con­ tinue these agents to reduce the risk for the devel­ opment of perioperative MACE.1",thompson-et-al-2024-aha-acc-acs-asnc-hrs-sca-scct-scmr-svm-guideline-for-perioperative-cardiovascular-management-for.pdf
id_01563,2024,26,2A,C-LD,"In patients with severe† PH undergoing elevated- risk NCS, referral to or consultation with a special­ ized PH center that can support risk assessment, optimization, and postoperative management (with consideration of intensive care after NCS) is reason­ able to reduce perioperative cardiopulmonary compli­ cations.2",thompson-et-al-2024-aha-acc-acs-asnc-hrs-sca-scct-scmr-svm-guideline-for-perioperative-cardiovascular-management-for.pdf
id_01564,2024,26,2A,C-LD,"In patients with severe† PH undergoing elevated- risk NCS, invasive hemodynamic monitoring is reasonable to guide intraoperative and postoperative care.3–5 Table 9.  Preoperative and Intraoperative Management Considerations in Patients With Hypertrophic Cardiomyopathy Management Considerations Continue beta blockers and/or nondihydropyridine calcium channel blockers without interruption in the perioperative period Avoid hypovolemia and reduced preload (can worsen LVOT obstruction) Avoid hypotension and reduced afterload (can worsen LVOT obstruction) Avoid tachycardia to ensure adequate LV filling If hypotension develops: Prioritize intravenous fluid administration to correct hypovolemia Use alpha-agonists, such as phenylephrine or vasopressin,7 rather than beta-agonists, which can worsen LVOT obstruction Consider intraoperative echocardiography to evaluate LVOT obstruction in the setting of hypotension In selected cases, intravenous beta-blockade may be necessary to reduce LV myocardial contractility and relieve LVOT obstruction",thompson-et-al-2024-aha-acc-acs-asnc-hrs-sca-scct-scmr-svm-guideline-for-perioperative-cardiovascular-management-for.pdf
id_01565,2024,27,2B,C-EO,"In patients with precapillary PH undergoing elevated- risk NCS, perioperative administration of short-acting inhaled pulmonary vasodilators (eg, nitric oxide, aero­ solized prostacyclins) may be reasonable to reduce elevated RV afterload and prevent acute decompen­ sated right HF.6 *For example, nitric oxide pathway mediators, endothelin receptor antagonists, prostacyclin pathway agonists, or a combination of these. †Severe PH is defined according to hemodynamics (severe precapillary PH component by right heart catheterization and echocardiography) and additional data derived from clinical assessment, exercise tests, and laboratory biomarkers. Hemodynamically, severe PH displays a mean pulmonary artery (PA) pressure >40 mm Hg, pulmonary vascular resistance >5 Wood units, or echocardiographic evidence of significant RV dysfunction (eg, RV-to-LV diastolic diameter ratio >0.8 or RV dysfunction that is graded as moderate or severe). Although all 5 World Symposium on Pulmonary Hypertension group classifications display some de­ gree of risk for developing severe PH, Group 1 (PAH), Group 3 (PH due to lung disease), and Group 4 (chronic thromboembolic PH) are at high risk for devel­ oping severe PH if left untreated and may be best managed and followed at a center with PH specialists.",thompson-et-al-2024-aha-acc-acs-asnc-hrs-sca-scct-scmr-svm-guideline-for-perioperative-cardiovascular-management-for.pdf
id_01566,2024,28,Class 1,B-NR,"In patients with intermediate- to elevated-risk congenital heart disease (CHD) lesions (Table 10) undergoing elective NCS, preoperative con­ sultation with an adult congenital heart disease (ACHD) specialist is recommended before the surgery.*1–4 *Modified from the “2018 AHA/ACC Guideline for Management of ACHD.”5 Table 10.  Adult Congenital Heart Disease Risk Stratification Before Noncardiac Surgery Risk Anatomy Functional/Hemodynamic Status Low Risk Patients with isolated small CHD lesions Patients with repaired CHD lesion with no residual shunt Patients with bicuspid aortic valve disease and aortopathy NYHA class I functional status, normal exercise capacity No chamber enlargement on imaging No residual shunt No PAH No arrhythmias Intermediate risk Unrepaired moderate-large shunts (ASD, VSD, PDA, AVSD) Repaired CHD with moderate to large residual shunt (ASD, VSD, PDA, AVSD) Obstructive left-sided lesions (congenital mitral stenosis, subaortic stenosis, supravalvular aortic stenosis, coarctation of aorta) except the ones described as low risk Obstructive right-sided lesion (pulmonary stenosis, branch pulmonary stenosis, repaired tetralogy of Fallot) Ebstein anomaly (disease spectrum includes mild, moderate, and severe variations) Anomalous coronary artery arising from the pulmonary artery Anomalous aortic origin of a coronary artery from the opposite sinus, especially with an interarterial or intramural course NYHA class II-IV functional status Limited exercise capacity Presence of residual shunt Presence of PAH Presence of cardiac chamber enlargement Significant valvular dysfunction (more than mild in severity) Arrhythmias requiring treatment Presence of HF Elevated risk Single-ventricle patients (palliated or status post Fontan procedure), unrepaired or palliated cyanotic CHD, double outlet right ventricle, pulmonary atresia, truncus arteriosus, TGA (classic or d-TGA; CCTGA or l-TGA), interrupted aortic arch NYHA class II-IV functional status Limited exercise capacity Significant valvular dysfunction (more than mild in severity) Arrhythmias requiring treatment Presence of PAH Presence of HF",thompson-et-al-2024-aha-acc-acs-asnc-hrs-sca-scct-scmr-svm-guideline-for-perioperative-cardiovascular-management-for.pdf
id_01567,2024,29,Class 1,C-EO,"In patients with a left ventricular assist device (LVAD), coordination with the LVAD care team on the appro­ priate timing and perioperative considerations of elective NCS is recommended to mitigate the risk of perioperative MACE.",thompson-et-al-2024-aha-acc-acs-asnc-hrs-sca-scct-scmr-svm-guideline-for-perioperative-cardiovascular-management-for.pdf
id_01568,2024,30,Class 1,C-LD,"Patients with severe AS should be evaluated for the need for aortic valve intervention before elective NCS to reduce perioperative risk.*1,2",thompson-et-al-2024-aha-acc-acs-asnc-hrs-sca-scct-scmr-svm-guideline-for-perioperative-cardiovascular-management-for.pdf
id_01569,2024,30,Class 1,C-EO,"In patients with suspected moderate or severe AS who are undergoing elevated-risk NCS, preoperative echocardiography is recommended before elective NCS to guide perioperative management.*",thompson-et-al-2024-aha-acc-acs-asnc-hrs-sca-scct-scmr-svm-guideline-for-perioperative-cardiovascular-management-for.pdf
id_01570,2024,30,2A,C-LD,"In asymptomatic patients with moderate or severe AS and normal LV systolic function as assessed by echocardiography within the past year, it is reason­ able to proceed with elective low-risk NCS.3–5 *Modified from the “2020 ACC/AHA Guideline for the Management of Pa­ tients With Valvular Heart Disease.”6",thompson-et-al-2024-aha-acc-acs-asnc-hrs-sca-scct-scmr-svm-guideline-for-perioperative-cardiovascular-management-for.pdf
id_01571,2024,32,Class 1,B-NR,Patients with severe mitral stenosis (MS) should be evaluated for the need for mitral valve (MV) interven­ tion before elective NCS.1–17,thompson-et-al-2024-aha-acc-acs-asnc-hrs-sca-scct-scmr-svm-guideline-for-perioperative-cardiovascular-management-for.pdf
id_01572,2024,32,2A,C-EO,"In patients with severe MS who cannot undergo MV intervention before NCS, perioperative invasive hemodynamic monitoring is reasonable to guide management to reduce the risk of cardiovascular complications.",thompson-et-al-2024-aha-acc-acs-asnc-hrs-sca-scct-scmr-svm-guideline-for-perioperative-cardiovascular-management-for.pdf
id_01573,2024,32,2B,C-LD,"In patients with severe MS who cannot undergo MV intervention before NCS, perioperative heart-rate control (eg, beta blockers, calcium channel blockers [CCBs], ivabradine, digoxin) may be considered to prolong diastolic filling time and decrease periopera­ tive cardiovascular complications.18–21",thompson-et-al-2024-aha-acc-acs-asnc-hrs-sca-scct-scmr-svm-guideline-for-perioperative-cardiovascular-management-for.pdf
id_01574,2024,33,Class 1,C-EO,"In patients with suspected moderate or severe val­ vular regurgitation, preoperative echocardiography is recommended before elective NCS to guide periop­ erative management.*",thompson-et-al-2024-aha-acc-acs-asnc-hrs-sca-scct-scmr-svm-guideline-for-perioperative-cardiovascular-management-for.pdf
id_01575,2024,33,Class 1,C-EO,"In patients with VHD who meet indications for valvular intervention based on clinical presentation and severity of regurgitation, the need for valvular intervention should be considered before elective elevated-risk NCS to reduce perioperative risk.*1–3",thompson-et-al-2024-aha-acc-acs-asnc-hrs-sca-scct-scmr-svm-guideline-for-perioperative-cardiovascular-management-for.pdf
