id,Year,Page,COR,LOE,Recommendation,SourceFile
id_00800,2023,8,2A,B-NR,"In patients with high-grade aSAH, aneu- rysm treatment is reasonable, after careful discussion of likely prognosis with family members, to optimize patient outcome.28,30",hoh-et-al-2023-guideline-for-the-management-of-patients-with-aneurysmal-subarachnoid-hemorrhage-a-guideline-from-the.pdf
id_00801,2023,8,2A,B-NR,"In patients with aSAH and advanced age, aneurysm treatment is reasonable, after care- ful discussion of prognosis with family mem- bers, to improve survival and outcome.31–33",hoh-et-al-2023-guideline-for-the-management-of-patients-with-aneurysmal-subarachnoid-hemorrhage-a-guideline-from-the.pdf
id_00802,2023,8,Class 3: No Benefit,B-NR,"In patients with aSAH who do not improve after correction of modifiable conditions and are deemed unsalvageable because of evi- dence of irreversible neurological injury, treat- ment of the aneurysm is not beneficial.34,35",hoh-et-al-2023-guideline-for-the-management-of-patients-with-aneurysmal-subarachnoid-hemorrhage-a-guideline-from-the.pdf
id_00803,2023,9,Class 1,B-NR,"In patients with acute onset of severe headache, prompt diagnostic workup and evaluation are recommended to diagnose/ exclude aSAH and minimize morbidity and mortality.43–46",hoh-et-al-2023-guideline-for-the-management-of-patients-with-aneurysmal-subarachnoid-hemorrhage-a-guideline-from-the.pdf
id_00804,2023,9,Class 1,B-NR,"In patients with acute onset of severe head- ache who present >6 hours from symptom onset or who have a new neurological defi- cit, a noncontrast head CT and, if negative for aSAH, lumbar puncture (LP) should be performed to diagnose/exclude aSAH.47,48",hoh-et-al-2023-guideline-for-the-management-of-patients-with-aneurysmal-subarachnoid-hemorrhage-a-guideline-from-the.pdf
id_00805,2023,9,2A,B-NR,"In patients with acute onset of severe head- ache who present <6 hours from symptom onset and without new neurological deficit, a noncontrast head CT performed on a high-quality scanner and interpreted by a board-certified neuroradiologist is reason- able to diagnose/exclude aSAH.49–53",hoh-et-al-2023-guideline-for-the-management-of-patients-with-aneurysmal-subarachnoid-hemorrhage-a-guideline-from-the.pdf
id_00806,2023,9,2B,B-NR,"In patients with acute onset of severe headache without a new neurological deficit, application of the Ottawa SAH Rule may be reasonable to identify those at high risk for aSAH.45,54,55 Evaluation for cause of aSAH",hoh-et-al-2023-guideline-for-the-management-of-patients-with-aneurysmal-subarachnoid-hemorrhage-a-guideline-from-the.pdf
id_00807,2023,9,Class 1,B-NR,"In patients with spontaneous SAH with high level of concern for aneurysmal source and a negative or inconclusive CT angiography (CTA), digital subtraction angiography (DSA) is indicated to diag- nose/exclude cerebral aneurysm(s).56–59",hoh-et-al-2023-guideline-for-the-management-of-patients-with-aneurysmal-subarachnoid-hemorrhage-a-guideline-from-the.pdf
id_00808,2023,9,2A,B-NR,"In patients with SAH from confirmed cerebral aneurysm(s), DSA can be useful to determine the optimal strategy for aneurysm intervention.60,61 Downloaded from http://ahajournals.org by on June 19, 2025",hoh-et-al-2023-guideline-for-the-management-of-patients-with-aneurysmal-subarachnoid-hemorrhage-a-guideline-from-the.pdf
id_00809,2023,11,Class 1,B-NR,"For patients with aSAH, timely transfer from hospitals with low case volume to higher-volume centers with multidisci- plinary neurointensive care services, com- prehensive stroke center capabilities, and experienced cerebrovascular surgeons/ neuroendovascular interventionalists is recommended to improve outcomes.67–77",hoh-et-al-2023-guideline-for-the-management-of-patients-with-aneurysmal-subarachnoid-hemorrhage-a-guideline-from-the.pdf
id_00810,2023,11,Class 1,B-NR,"For patients with aSAH, care should be provided in a dedicated neurocritical care unit by a multidisciplinary team.78–80 Table 3.  Ottawa SAH Rule For alert patients >15 y of age with new severe nontraumatic headache reaching maximum intensity within 1 h. Patients require additional investigation for SAH if they meet any of the following criteria:",hoh-et-al-2023-guideline-for-the-management-of-patients-with-aneurysmal-subarachnoid-hemorrhage-a-guideline-from-the.pdf
id_00811,2023,13,Class 1,C-EO,"In patients with aSAH and unsecured aneurysm, frequent blood pressure (BP) monitoring and BP control with short- acting medication(s) is recommended to avoid severe hypotension, hypertension, and BP variability.",hoh-et-al-2023-guideline-for-the-management-of-patients-with-aneurysmal-subarachnoid-hemorrhage-a-guideline-from-the.pdf
id_00812,2023,13,Class 1,C-EO,"In patients with aSAH who are receiving anticoagulants, emergency anticoagula- tion reversal with appropriate reversal agents should be performed to prevent rebleeding.",hoh-et-al-2023-guideline-for-the-management-of-patients-with-aneurysmal-subarachnoid-hemorrhage-a-guideline-from-the.pdf
id_00813,2023,13,Class 3: No Benefit,A,"In patients with aSAH, routine use of anti- fibrinolytic therapy is not useful to improve functional outcome.85–87",hoh-et-al-2023-guideline-for-the-management-of-patients-with-aneurysmal-subarachnoid-hemorrhage-a-guideline-from-the.pdf
id_00814,2023,14,Class 1,B-NR,"For patients with aSAH, surgical or endovascular treatment of the ruptured aneurysm should be performed as early as feasible after presentation, preferably within 24 hours of onset, to improve outcome.40,98–104 Treatment goal",hoh-et-al-2023-guideline-for-the-management-of-patients-with-aneurysmal-subarachnoid-hemorrhage-a-guideline-from-the.pdf
id_00815,2023,14,Class 1,B-NR,"For patients with aSAH, complete oblit- eration of the ruptured aneurysm is indi- cated whenever feasible to reduce the risk of rebleeding and retreatment.105–107",hoh-et-al-2023-guideline-for-the-management-of-patients-with-aneurysmal-subarachnoid-hemorrhage-a-guideline-from-the.pdf
id_00816,2023,14,2A,C-EO,"For patients with aSAH in whom com- plete obliteration of the ruptured aneu- rysm by either clipping or primary coiling treatment is not feasible in the acute phase, partial obliteration to secure the rupture site and retreatment in a delayed fashion in those with functional recovery are reasonable to prevent rebleeding. Modality of treatment: general",hoh-et-al-2023-guideline-for-the-management-of-patients-with-aneurysmal-subarachnoid-hemorrhage-a-guideline-from-the.pdf
id_00817,2023,14,Class 1,B-R,"For patients with aSAH from ruptured aneurysms of the posterior circulation that are amenable to coiling, coiling is indicated in preference to clipping to improve outcome.108–110",hoh-et-al-2023-guideline-for-the-management-of-patients-with-aneurysmal-subarachnoid-hemorrhage-a-guideline-from-the.pdf
id_00818,2023,14,Class 1,B-R,"For patients with aSAH deemed salvageable and with depressed level of consciousness due to large intrapa- renchymal hematoma, emergency clot evacuation should be performed to reduce mortality.111,112",hoh-et-al-2023-guideline-for-the-management-of-patients-with-aneurysmal-subarachnoid-hemorrhage-a-guideline-from-the.pdf
id_00819,2023,14,Class 1,C-EO,"For patients with aSAH, the ruptured aneu- rysm should be evaluated by specialist(s) with endovascular and surgical expertise to determine the relative risks and benefits of surgical or endovascular treatment accord- ing to patient and aneurysm characteristics.",hoh-et-al-2023-guideline-for-the-management-of-patients-with-aneurysmal-subarachnoid-hemorrhage-a-guideline-from-the.pdf
id_00820,2023,14,2B,B-R,"For patients >70 years of age with aSAH, the superiority of coiling or clipping to improve outcome is not well established.113,114",hoh-et-al-2023-guideline-for-the-management-of-patients-with-aneurysmal-subarachnoid-hemorrhage-a-guideline-from-the.pdf
id_00821,2023,14,2B,C-LD,"For patients <40 years of age with aSAH, clipping of the ruptured aneurysm might be considered the preferred mode of treatment to improve durability of the treatment and outcome.113,115 Modality of treatment: for aneurysms equally suitable for clipping and coiling",hoh-et-al-2023-guideline-for-the-management-of-patients-with-aneurysmal-subarachnoid-hemorrhage-a-guideline-from-the.pdf
id_00822,2023,14,Class 1,A,"For patients with good-grade aSAH from ruptured aneurysms of the anterior circulation equally suitable for both primary coiling and clipping, primary coiling is recommended in preference to clipping to improve 1-year functional outcome.110,116",hoh-et-al-2023-guideline-for-the-management-of-patients-with-aneurysmal-subarachnoid-hemorrhage-a-guideline-from-the.pdf
id_00823,2023,14,2A,B-R,"For patients with good-grade aSAH from ruptured aneurysms of the anterior circulation equally suitable for both primary coiling and clipping, both treat- ment options are reasonable to achieve favorable long-term outcome.108,109,117 Endovascular adjuncts",hoh-et-al-2023-guideline-for-the-management-of-patients-with-aneurysmal-subarachnoid-hemorrhage-a-guideline-from-the.pdf
id_00824,2023,14,2A,C-LD,"For patients with aSAH from ruptured wide-neck aneurysms not amenable to surgical clipping or primary coiling, endo- vascular treatment with stent-assisted coiling or flow diverters is reasonable to reduce the risk of rebleed.118,119",hoh-et-al-2023-guideline-for-the-management-of-patients-with-aneurysmal-subarachnoid-hemorrhage-a-guideline-from-the.pdf
id_00825,2023,14,2A,C-LD,"For patients with aSAH from ruptured fusiform/blister aneurysms, the use of flow diverters is reasonable to reduce mortality.120,121",hoh-et-al-2023-guideline-for-the-management-of-patients-with-aneurysmal-subarachnoid-hemorrhage-a-guideline-from-the.pdf
id_00826,2023,14,Class 3: Harm,B-NR,"For patients with aSAH from ruptured saccular aneurysms amenable to either primary coiling or clipping, stents or flow diverters should not be used to avoid higher risk of complications.122,123 Recommendations for Surgical and Endovascular Methods for Treatment of Ruptured Cerebral Aneurysms (Continued) COR LOE Recommendations Downloaded from http://ahajournals.org by on June 19, 2025",hoh-et-al-2023-guideline-for-the-management-of-patients-with-aneurysmal-subarachnoid-hemorrhage-a-guideline-from-the.pdf
id_00827,2023,17,2A,B-R,"In patients with aSAH, the intraoperative use of mannitol or hypertonic saline can be effective in reducing ICP and cerebral edema.135,136",hoh-et-al-2023-guideline-for-the-management-of-patients-with-aneurysmal-subarachnoid-hemorrhage-a-guideline-from-the.pdf
id_00828,2023,17,2A,B-NR,"In patients with aSAH, anesthetic goals should include minimizing postprocedural pain, nausea, and vomiting.137–140",hoh-et-al-2023-guideline-for-the-management-of-patients-with-aneurysmal-subarachnoid-hemorrhage-a-guideline-from-the.pdf
id_00829,2023,17,2A,B-NR,"In patients with aSAH, prevention of intraoperative hyperglycemia and hypogly- cemia during aneurysm surgery is reason- able to improve outcomes.141–147",hoh-et-al-2023-guideline-for-the-management-of-patients-with-aneurysmal-subarachnoid-hemorrhage-a-guideline-from-the.pdf
id_00830,2023,17,2A,C-LD,"In patients with aSAH and an unsecured ruptured aneurysm, frequent intraopera- tive BP monitoring and BP control are reasonable to prevent ischemia and rerupture.148–153",hoh-et-al-2023-guideline-for-the-management-of-patients-with-aneurysmal-subarachnoid-hemorrhage-a-guideline-from-the.pdf
id_00831,2023,17,2B,B-NR,"In patients with aSAH, intraoperative neuromonitoring may be reasonable to guide anesthetic and operative management.154–159",hoh-et-al-2023-guideline-for-the-management-of-patients-with-aneurysmal-subarachnoid-hemorrhage-a-guideline-from-the.pdf
id_00832,2023,17,2B,C-LD,"In patients with aSAH and an uncontrolled intraoperative aneurysmal rupture, adenosine may be considered to facilitate aneurysm clip placement by inducing cardiac standstill and temporary profound pause.160,161",hoh-et-al-2023-guideline-for-the-management-of-patients-with-aneurysmal-subarachnoid-hemorrhage-a-guideline-from-the.pdf
id_00833,2023,17,Class 3: No Benefit,B-R,"In patients with good-grade aSAH, the routine use of induced mild hypothermia during aneurysm surgery is not benefi- cial.147,162–168",hoh-et-al-2023-guideline-for-the-management-of-patients-with-aneurysmal-subarachnoid-hemorrhage-a-guideline-from-the.pdf
id_00834,2023,19,Class 1,B-NR,"In patients with aSAH who require mechanical ventilation for >24 hours, implementation of a standardized ICU care bundle is recommended to reduce the duration of mechanical ventilation and hospital-acquired pneumonia.177,178 Downloaded from http://ahajournals.org by on June 19, 2025",hoh-et-al-2023-guideline-for-the-management-of-patients-with-aneurysmal-subarachnoid-hemorrhage-a-guideline-from-the.pdf
id_00835,2023,20,2B,B-NR,"In patients with aSAH who develop severe acute respiratory distress syndrome (ARDS) and life-threatening hypoxemia, rescue maneuvers such as prone position- ing and alveolar recruitment maneuvers with ICP monitoring may be reasonable to improve oxygenation.179–182 Intravascular volume and electrolyte management",hoh-et-al-2023-guideline-for-the-management-of-patients-with-aneurysmal-subarachnoid-hemorrhage-a-guideline-from-the.pdf
id_00836,2023,20,2A,B-R,"In patients with aSAH, close monitor- ing and goal-directed treatment of volume status are reasonable to maintain euvolemia.183–185",hoh-et-al-2023-guideline-for-the-management-of-patients-with-aneurysmal-subarachnoid-hemorrhage-a-guideline-from-the.pdf
id_00837,2023,20,2A,B-R,"In patients with aSAH, use of mineralocor- ticoids is reasonable to treat natriuresis and hyponatremia.186,187",hoh-et-al-2023-guideline-for-the-management-of-patients-with-aneurysmal-subarachnoid-hemorrhage-a-guideline-from-the.pdf
id_00838,2023,20,Class 3: Harm,B-R,"In patients with aSAH, induction of hyper- volemia is potentially harmful because of the association with excess morbid- ity.188–190 Other",hoh-et-al-2023-guideline-for-the-management-of-patients-with-aneurysmal-subarachnoid-hemorrhage-a-guideline-from-the.pdf
id_00839,2023,20,Class 1,C-LD,"In patients with aSAH whose ruptured aneurysm has been secured, pharmaco- logical or mechanical venous thromboem- bolism (VTE) prophylaxis is recommended to reduce the risk for VTE.191–193",hoh-et-al-2023-guideline-for-the-management-of-patients-with-aneurysmal-subarachnoid-hemorrhage-a-guideline-from-the.pdf
id_00840,2023,20,2A,B-NR,"In patients with aSAH, effective glycemic control, strict hyperglycemia management, and avoidance of hypoglycemia are rea- sonable to improve outcome.141,142,194,195",hoh-et-al-2023-guideline-for-the-management-of-patients-with-aneurysmal-subarachnoid-hemorrhage-a-guideline-from-the.pdf
id_00841,2023,20,2B,C-LD,"In patients with aSAH with fever refractory to antipyretic medications, the effective- ness of therapeutic temperature manage- ment (TTM) during the acute phase of aSAH is uncertain.196–198",hoh-et-al-2023-guideline-for-the-management-of-patients-with-aneurysmal-subarachnoid-hemorrhage-a-guideline-from-the.pdf
id_00842,2023,22,Class 1,B-R,"In patients with aSAH, use of evidence- based protocols and order sets is recom- mended to improve standardization of care.243–250",hoh-et-al-2023-guideline-for-the-management-of-patients-with-aneurysmal-subarachnoid-hemorrhage-a-guideline-from-the.pdf
id_00843,2023,22,Class 1,B-NR,"In patients with aSAH, frequent neuro- logical assessment with a neurological assessment tool such as the GCS or National Institutes of Health Stroke Scale (NIHSS) is recommended to monitor DCI and other secondary complica- tions.246,251–254",hoh-et-al-2023-guideline-for-the-management-of-patients-with-aneurysmal-subarachnoid-hemorrhage-a-guideline-from-the.pdf
id_00844,2023,22,Class 1,B-NR,"In patients with aSAH, frequent vital sign and neurological monitoring is recommended for detection of neu- rological change and prevention of secondary cerebral insults and poor outcomes.244,246,250,255–257 Downloaded from http://ahajournals.org by on June 19, 2025",hoh-et-al-2023-guideline-for-the-management-of-patients-with-aneurysmal-subarachnoid-hemorrhage-a-guideline-from-the.pdf
id_00845,2023,23,Class 1,B-NR,"In patients with aSAH, a validated dysphagia screening protocol should be implemented before initiation of oral intake to reduce the incidence of pneumo- nia.244,246,258–261",hoh-et-al-2023-guideline-for-the-management-of-patients-with-aneurysmal-subarachnoid-hemorrhage-a-guideline-from-the.pdf
id_00846,2023,23,2A,C-LD,"In patients with aSAH, specialized nursing stroke competencies and certification can be effective to positively affect outcomes, timeliness of care, and adherence to stroke protocols.248,262–264",hoh-et-al-2023-guideline-for-the-management-of-patients-with-aneurysmal-subarachnoid-hemorrhage-a-guideline-from-the.pdf
id_00847,2023,23,2A,C-LD,"In patients with aSAH and a secured aneurysm, an early, evidence-based mobility algorithm is reasonable to improve level of function at discharge and global functional outcome at 12 months.249,265–268",hoh-et-al-2023-guideline-for-the-management-of-patients-with-aneurysmal-subarachnoid-hemorrhage-a-guideline-from-the.pdf
id_00848,2023,25,2A,B-NR,"In patients with aSAH with suspected vasospasm or limited neurological exami- nation, CTA or CT perfusion (CTP) can be useful to detect vasospasm and predict DCI.270–275",hoh-et-al-2023-guideline-for-the-management-of-patients-with-aneurysmal-subarachnoid-hemorrhage-a-guideline-from-the.pdf
id_00849,2023,25,2A,B-NR,"In patients with aSAH, transcranial Doppler (TCD) ultrasound monitoring is reasonable to detect vasospasm and predict DCI.253,276–280",hoh-et-al-2023-guideline-for-the-management-of-patients-with-aneurysmal-subarachnoid-hemorrhage-a-guideline-from-the.pdf
id_00850,2023,25,2A,B-NR,"In patients with high-grade aSAH, con- tinuous EEG (cEEG) monitoring can be useful to predict DCI.276,280–292",hoh-et-al-2023-guideline-for-the-management-of-patients-with-aneurysmal-subarachnoid-hemorrhage-a-guideline-from-the.pdf
id_00851,2023,25,2B,B-NR,"In patients with high-grade aSAH, invasive monitoring of brain tissue oxygenation, lactate/pyruvate ratio, and glutamate may be considered to predict DCI.293–305",hoh-et-al-2023-guideline-for-the-management-of-patients-with-aneurysmal-subarachnoid-hemorrhage-a-guideline-from-the.pdf
id_00852,2023,26,Class 1,A,"In patients with aSAH, early initiation of enteral nimodipine is beneficial in preventing DCI and improving functional outcomes.316–319",hoh-et-al-2023-guideline-for-the-management-of-patients-with-aneurysmal-subarachnoid-hemorrhage-a-guideline-from-the.pdf
id_00853,2023,26,2A,B-NR,"In patients with aSAH, maintaining euvolemia can be beneficial in preventing DCI and improving functional outcomes.320,321",hoh-et-al-2023-guideline-for-the-management-of-patients-with-aneurysmal-subarachnoid-hemorrhage-a-guideline-from-the.pdf
id_00854,2023,26,2B,B-NR,"In patients with aSAH and symptomatic vasospasm, elevating systolic BP values may be reasonable to reduce the progres- sion and severity of DCI.322–325",hoh-et-al-2023-guideline-for-the-management-of-patients-with-aneurysmal-subarachnoid-hemorrhage-a-guideline-from-the.pdf
id_00855,2023,26,2B,B-NR,"In patients with aSAH and severe vaso- spasm, use of intra-arterial vasodilator therapy may be reasonable to reverse cerebral vasospasm and reduce the pro- gression and severity of DCI.326–335",hoh-et-al-2023-guideline-for-the-management-of-patients-with-aneurysmal-subarachnoid-hemorrhage-a-guideline-from-the.pdf
id_00856,2023,26,2B,B-NR,"In patients with aSAH and severe vasospasm, cerebral angioplasty may be reasonable to reverse cerebral vasospasm and reduce the progression and severity of DCI.336–344",hoh-et-al-2023-guideline-for-the-management-of-patients-with-aneurysmal-subarachnoid-hemorrhage-a-guideline-from-the.pdf
id_00857,2023,26,Class 3: No Benefit,A,"In patients with aSAH, routine use of statin therapy to improve outcomes is not recommended.345,346",hoh-et-al-2023-guideline-for-the-management-of-patients-with-aneurysmal-subarachnoid-hemorrhage-a-guideline-from-the.pdf
id_00858,2023,26,Class 3: No Benefit,A,"In patients with aSAH, routine use of intra- venous magnesium to improve neurologi- cal outcomes is not recommended.347,348",hoh-et-al-2023-guideline-for-the-management-of-patients-with-aneurysmal-subarachnoid-hemorrhage-a-guideline-from-the.pdf
id_00859,2023,26,Class 3: Harm,B-R,"For patients with aSAH at risk of DCI, prophylactic hemodynamic augmenta- tion should not be performed to reduce iatrogenic patient harm.189,211,349,350 Downloaded from http://ahajournals.org by on June 19, 2025",hoh-et-al-2023-guideline-for-the-management-of-patients-with-aneurysmal-subarachnoid-hemorrhage-a-guideline-from-the.pdf
id_00860,2023,30,Class 1,B-NR,"In patients with aSAH and acute symptomatic hydrocephalus, urgent CSF diversion (EVD and/or lumbar drainage) should be performed to improve neurological outcome.236,384–387",hoh-et-al-2023-guideline-for-the-management-of-patients-with-aneurysmal-subarachnoid-hemorrhage-a-guideline-from-the.pdf
id_00861,2023,30,Class 1,B-NR,"In patients with aSAH and hydrocephalus who require an EVD, implementation and adherence to an EVD bundled protocol that addresses insertion, management, education, and monitoring are recom- mended to reduce complication and infection rates.388–396",hoh-et-al-2023-guideline-for-the-management-of-patients-with-aneurysmal-subarachnoid-hemorrhage-a-guideline-from-the.pdf
id_00862,2023,30,Class 1,B-NR,"In patients with aSAH and associated chronic symptomatic hydrocephalus, per- manent CSF diversion is recommended to improve neurological outcome.397–400",hoh-et-al-2023-guideline-for-the-management-of-patients-with-aneurysmal-subarachnoid-hemorrhage-a-guideline-from-the.pdf
id_00863,2023,30,Class 3: No Benefit,C-LD,"In patients with aSAH, routine fenestration of the lamina terminalis is not indicated for reducing the rate of shunt dependency.401",hoh-et-al-2023-guideline-for-the-management-of-patients-with-aneurysmal-subarachnoid-hemorrhage-a-guideline-from-the.pdf
id_00864,2023,31,2A,B-NR,"In patients with aSAH and either fluctuat- ing neurological examination, depressed mental state, ruptured MCA aneurysm, high-grade SAH, ICH, hydrocephalus, or cortical infarction, cEEG monitoring is reasonable to detect seizures.291,405,406",hoh-et-al-2023-guideline-for-the-management-of-patients-with-aneurysmal-subarachnoid-hemorrhage-a-guideline-from-the.pdf
id_00865,2023,31,2B,B-NR,"In patients with aSAH and high-seizure- risk features (ie, ruptured MCA aneurysm, high-grade SAH, ICH, hydrocephalus, and cortical infarction), use of prophylactic antiseizure medication(s) may be reason- able to prevent seizures.407–413",hoh-et-al-2023-guideline-for-the-management-of-patients-with-aneurysmal-subarachnoid-hemorrhage-a-guideline-from-the.pdf
id_00866,2023,31,Class 3: No Benefit,B-R,"In patients with aSAH without high- seizure-risk features (ie, ruptured MCA aneurysm, high-grade SAH, ICH, hydrocephalus, and cortical infarction), prophylactic treatment with antiseizure medication is not beneficial.406–408,410,414 Table 4.  Elements for an EVD Infection Control Bundled Protocol388–395 Insertion and technique Management Monitoring and education EVD setup Type of dressing Health care professional training (insertion and management) Aseptic technique Frequency of dressing change Staff education and competency Skin preparation Flushing of EVD system Monitoring number of EVD catheter days EVD insertion location (ICU, OR, other) CSF sampling frequency Monitoring rates of infection EVD insertion health care professional (neuro- surgery, ICU, resident, APP) CSF sampling technique Uniform definition for ventriculostomy-associ- ated infection Catheter selection (size, antibiotic impregnated) EVD manipulation Use of EVD order panel Procedure timeout Catheter or system exchange Nursing handoff EVD clamping and weaning Mobilization safety",hoh-et-al-2023-guideline-for-the-management-of-patients-with-aneurysmal-subarachnoid-hemorrhage-a-guideline-from-the.pdf
id_00867,2023,32,Class 3: Harm,B-NR,"In patients with aSAH, phenytoin for seizure prevention and/or antiseizure prophylaxis is associated with excess morbidity and mortality.407–411,413,415,416 Patients who present with seizures",hoh-et-al-2023-guideline-for-the-management-of-patients-with-aneurysmal-subarachnoid-hemorrhage-a-guideline-from-the.pdf
id_00868,2023,32,2A,B-NR,"In patients with aSAH who present with seizures, treatment with antiseizure medications for ≤7 days is reasonable to reduce seizure-related complications in the perioperative period.411,417,418",hoh-et-al-2023-guideline-for-the-management-of-patients-with-aneurysmal-subarachnoid-hemorrhage-a-guideline-from-the.pdf
id_00869,2023,32,Class 3: No Benefit,B-NR,"In patients with aSAH without prior epilepsy who present with seizures, treat- ment with antiseizure medications beyond 7 days is not effective for reducing future SAH-associated seizure risk.408,410,411",hoh-et-al-2023-guideline-for-the-management-of-patients-with-aneurysmal-subarachnoid-hemorrhage-a-guideline-from-the.pdf
id_00870,2023,33,Class 1,B-NR,"In patients with aSAH, use of validated grading scores or patient-reported outcome measures prior to hospital discharge is recommended to screen for physical, cognitive, behavioral, and QOL deficits.39,425–431",hoh-et-al-2023-guideline-for-the-management-of-patients-with-aneurysmal-subarachnoid-hemorrhage-a-guideline-from-the.pdf
